Label,Text
spam,Marvel Mobile Play the official Ultimate Spider-man game (å£4.50) on ur mobile right now. Text SPIDER to 83338 for the game & we ll send u a FREE 8Ball wallpaper
ham,How's ur paper?
ham,"Well, i'm glad you didn't find it totally disagreeable ... Lol"
ham,Yunny... I'm goin to be late
ham,Too late. I said i have the website. I didn't i have or dont have the slippers
ham,Surely result will offer:)
ham,Lol I have to take it. member how I said my aunt flow didn't visit for 6 months? It's cause I developed ovarian cysts. Bc is the only way to shrink them.
ham,Whatsup there. Dont u want to sleep
ham,Its worse if if uses half way then stops. Its better for him to complete it.
ham,"THATåÕS ALRITE GIRL, U KNOW GAIL IS NEVA WRONG!!TAKE CARE SWEET AND DONåÕT WORRY.C U L8TR HUN!LOVE Yaxxx"
ham,Good. do you think you could send me some pix? I would love to see your top and bottom...
ham,I hope you know I'm still mad at you.
ham,Noooooooo please. Last thing I need is stress. For once in your life be fair.
ham,Tomarrow i want to got to court. At  &lt;DECIMAL&gt; . So you come to bus stand at 9.
ham,Lol ok ill try to send. Be warned Sprint is dead slow. You'll prolly get it tomorrow
ham,I love you both too :-)
spam,PRIVATE! Your 2003 Account Statement for 07815296484 shows 800 un-redeemed S.I.M. points. Call 08718738001 Identifier Code 41782 Expires 18/11/04 
ham,"Hi frnd, which is best way to avoid missunderstding wit our beloved one's?"
ham,"Erm... Woodland avenue somewhere. Do you get the parish magazine, his telephone number will be in there."
ham,I will take care of financial problem.i will help:)
ham,Hi Chachi tried calling u now unable to reach u .. Pl give me a missed cal once u c tiz msg  Kanagu
spam,Freemsg: 1-month unlimited free calls! Activate SmartCall Txt: CALL to No: 68866. Subscriptn3gbp/wk unlimited calls Help: 08448714184 Stop?txt stop landlineonly
ham,He needs to stop going to bed and make with the fucking dealing
ham,Ok... Take ur time n enjoy ur dinner...
ham,DO NOT B LATE LOVE MUM
ham,Also remember to get dobby's bowl from your car
ham,HI DARLIN I FINISH AT 3 DO U 1 2 PICK ME UP OR MEET ME? TEXT BACK ON THIS NUMBER LUV KATE XXX
ham,Unlimited texts. Limited minutes.
ham,"K, wen ur free come to my home and also tel vikky i hav sent mail to him also.. Better come evening il be free today aftr 6pm..:-)"
spam,Free Msg: Ringtone!From: http://tms. widelive.com/index. wml?id=1b6a5ecef91ff9*37819&first=true18:0430-JUL-05
spam,December only! Had your mobile 11mths+? You are entitled to update to the latest colour camera mobile for Free! Call The Mobile Update Co FREE on 08002986906
ham,Yeah like if it goes like it did with my friends imma flip my shit in like half an hour
ham,Ok lor wat time Ì_ finish?
ham,Good evening! this is roger. How are you?
ham,Black shirt n blue jeans... I thk i c Ì_...
ham,Ok try to do week end course in coimbatore.
spam,"FREE RINGTONE text FIRST to 87131 for a poly or text GET to 87131 for a true tone! Help? 0845 2814032 16 after 1st free, tones are 3xå£150pw to eå£nd txt stop"
ham,Cheers for the card ... Is it that time of year already?
ham,HI DARLIN IVE JUST GOT BACK AND I HAD A REALLY NICE NIGHT AND THANKS SO MUCH FOR THE LIFT SEE U TOMORROW XXX
ham,"Hmm... Dunno leh, mayb a bag 4 goigng out dat is not too small. Or jus anything except perfume, smth dat i can keep."
ham,"Hi hope u r both ok, he said he would text and he hasn't, have u seen him, let me down gently please "
ham,Nutter. Cutter. Ctter. Cttergg. Cttargg. Ctargg. Ctagg. ie you
ham,Do I? I thought I put it back in the box
ham,Mark works tomorrow. He gets out at 5. His work is by your house so he can meet u afterwards.
ham,Went to pay rent. So i had to go to the bank to authorise the payment.
ham,Hi juan. Im coming home on fri hey. Of course i expect a welcome party and lots of presents. Ill phone u when i get back. Loads of love nicky x x x x x x x x x
ham,Stupid auto correct on my phone
ham,Tomarrow final hearing on my laptop case so i cant.
ham,"Sez, hows u & de arab boy? Hope u r all good give my love 2 evry1 love ya eshxxxxxxxxxxx"
spam,"Someone has contacted our dating service and entered your phone becausethey fancy you! To find out who it is call from a landline 09058098002. PoBox1, W14RG 150p"
spam,"Text82228>> Get more ringtones, logos and games from www.txt82228.com. Questions: info@txt82228.co.uk"
ham,What can i do? Might accidant tookplace between somewhere ghodbandar rd. Traffic moves slovely. So plz slip &amp; don't worry.
spam,You won't believe it but it's true. It's Incredible Txts! Reply G now to learn truly amazing things that will blow your mind. From O2FWD only 18p/txt
ham,"Just making dinner, you ?"
ham,It took Mr owl 3 licks
ham,"They can try! They can get lost, in fact. Tee hee"
ham,"Nope. Since ayo travelled, he has forgotten his guy"
spam,Dear Dave this is your final notice to collect your 4* Tenerife Holiday or #5000 CASH award! Call 09061743806 from landline. TCs SAE Box326 CW25WX 150ppm
ham,Lol I know! Hey someone did a great inpersonation of flea on the forums. I love it!
ham,"Hi. Wk been ok - on hols now! Yes on for a bit of a run. Forgot that i have hairdressers appointment at four so need to get home n shower beforehand. Does that cause prob for u?\""ham"""
ham,"Great. I'm in church now, will holla when i get out"
ham,"Wat time liao, where still got."
ham,Ah you see. You have to be in the lingo. I will let you know wot on earth it is when has finished making it!
spam,83039 62735=å£450 UK Break AccommodationVouchers terms & conditions apply. 2 claim you mustprovide your claim number which is 15541 
ham,Alright. I'm out--have a good night!
ham,WOT STUDENT DISCOUNT CAN U GET ON BOOKS?
ham,Yup no more already... Thanx 4 printing n handing it up.
ham,\ER
ham,Watching telugu movie..wat abt u?
ham,Feel Yourself That You Are Always Happy.. Slowly It Becomes Your Habit &amp; Finally It Becomes Part Of Your Life.. Follow It.. Happy Morning &amp; Have A Happy Day:)
ham,(That said can you text him one more time?)
ham,Message:some text missing* Sender:Name Missing* *Number Missing *Sent:Date missing *Missing U a lot thats y everything is missing sent via fullonsms.com
ham,What happened in interview?
ham,Correct. So how was work today
ham,Yup... I havent been there before... You want to go for the yoga? I can call up to book 
ham,ÌÏ still attending da talks?
ham,Yup i shd haf ard 10 pages if i add figures... ÌÏ all got how many pages?
ham,But I'm on a diet. And I ate 1 too many slices of pizza yesterday. Ugh I'm ALWAYS on a diet.
ham,I think chennai well settled?
ham,"Haha... Sounds crazy, dunno can tahan anot..."
ham,I need details about that online job.
ham,"Ola would get back to you maybe not today but I ve told him you can be his direct link in the US in getting cars he bids for online, you arrange shipping and you get a cut. Or U????? For a partnership where U????? Invest money for shipping and he takes care of the rest!U??Wud b self reliant soon dnt worry"
spam,HMV BONUS SPECIAL 500 pounds of genuine HMV vouchers to be won. Just answer 4 easy questions. Play Now! Send HMV to 86688 More info:www.100percent-real.com
ham,"Not much, just some textin'. How bout you?"
ham,"Sorry, I'll call later"
ham,"awesome, how do I deal with the gate? Charles told me last night but, uh, yeah"
ham,Hi mate its RV did u hav a nice hol just a message 3 say hello coz havenåÕt sent u 1 in ages started driving so stay off roads!RVx
ham,Lol for real. She told my dad I have cancer
ham,Ok. Me watching tv too.
ham,Ok. No wahala. Just remember that a friend in need ...
ham,Did you get any gift? This year i didnt get anything. So bad
ham,Ryder unsold.now gibbs.
ham,"Sweet, we may or may not go to 4U to meet carlos so gauge patty's interest in that"
ham,Ha! I wouldn't say that I just didn't read anything into way u seemed. I don't like 2 be judgemental....i save that for fridays in the pub!
ham,"Sorry,in meeting I'll call later"
spam,Free video camera phones with Half Price line rental for 12 mths and 500 cross ntwk mins 100 txts. Call MobileUpd8 08001950382 or Call2OptOut/674
spam,"Spook up your mob with a Halloween collection of a logo & pic message plus a free eerie tone, txt CARD SPOOK to 8007 zed 08701417012150p per logo/pic "
ham,"Sorry, was in the bathroom, sup"
spam,"For ur chance to win a å£250 wkly shopping spree TXT: SHOP to 80878. T's&C's www.txt-2-shop.com custcare 08715705022, 1x150p/wk"
ham,Ok lor...
ham,Die... Now i have e toot fringe again...
ham,U definitely need a module from e humanities dis sem izzit? U wan 2 take other modules 1st?
spam,"YOU 07801543489 are guaranteed the latests Nokia Phone, a 40GB iPod MP3 player or a å£500 prize! Txt word:COLLECT to No:83355! TC-LLC NY-USA 150p/Mt msgrcvd18+"
ham,Its ok my arm is feeling weak cuz i got a shot so we can go another time
ham,K...k:)why cant you come here and search job:)
ham,"I know you are thinkin malaria. But relax, children cant handle malaria. She would have been worse and its gastroenteritis. If she takes enough to replace her loss her temp will reduce. And if you give her malaria meds now she will just vomit. Its a self limiting illness she has which means in a few days it will completely stop"
ham,Tessy..pls do me a favor. Pls convey my birthday wishes to Nimya..pls dnt forget it. Today is her birthday Shijas
ham,Are your freezing ? Are you home yet ? Will you remember to kiss your mom in the morning? Do you love me ? Do you think of me ? Are you missing me yet ?
ham,My sister got placed in birla soft da:-)
ham,Cool. So how come you havent been wined and dined before?
ham,"Dear, will call Tmorrow.pls accomodate."
ham,What happen to her tell the truth
ham,"The sign of maturity is not when we start saying big things.. But actually it is, when we start understanding small things... *HAVE A NICE EVENING* BSLVYL"
ham,O we cant see if we can join denis and mina? Or does denis want alone time
ham,"Ah, well that confuses things, doesnÛ÷t it?"
ham,Lol well don't do it without me. We could have a big sale together.
ham,In meeting da. I will call you
ham,Hey check it da. I have listed da.
ham,I had askd u a question some hours before. Its answer
ham,"Hey elaine, is today's meeting still on?"
spam,SMS. ac sun0819 posts HELLO:\You seem cool
ham,Don't make life too stressfull.. Always find time to Laugh.. It may not add years to your Life! But surely adds more life to ur years!! Gud ni8..swt dreams..
ham,What is your record for one night? :)
ham,My stomach has been thru so much trauma I swear I just can't eat. I better lose weight.
ham,In xam hall boy asked girl Tell me the starting term for dis answer I can den manage on my own After lot of hesitation n lookin around silently she said THE! intha ponnungale ipaditan;)
ham,And by when you're done I mean now
ham,That sucks. So what do you got planned for your yo valentine? I am your yo valentine aren't I?
spam,Urgent Ur å£500 guaranteed award is still unclaimed! Call 09066368327 NOW closingdate04/09/02 claimcode M39M51 å£1.50pmmorefrommobile2Bremoved-MobyPOBox734LS27YF
ham,"Sorry, I'll call later  &lt;#&gt; mins"
ham,Short But Cute : \ Be a good person 
spam,Congrats! Nokia 3650 video camera phone is your Call 09066382422 Calls cost 150ppm Ave call 3mins vary from mobiles 16+ Close 300603 post BCM4284 Ldn WC1N3XX
ham,Smile in Pleasure Smile in Pain Smile when trouble pours like Rain Smile when sum1 Hurts U Smile becoz SOMEONE still Loves to see u Smiling!!
ham,No need to ke qi... ÌÏ too bored izzit y suddenly thk of this...
ham,S:-)if we have one good partnership going we will take lead:)
ham,Hey what's up charles sorry about the late reply.
ham,Oops my phone died and I didn't even know. Yeah I like it better.
ham,"Kate jackson rec center before 7ish, right?"
spam,"Latest News! Police station toilet stolen, cops have nothing to go on!"
ham,"Sorry, I'll call later in meeting any thing related to trade please call Arul. &lt;#&gt; "
ham,Thank u!
ham,Bugis oso near wat... 
spam,URGENT! We are trying to contact U. Todays draw shows that you have won a å£2000 prize GUARANTEED. Call 09058094507 from land line. Claim 3030. Valid 12hrs only
ham,LOL what happens in Vegas stays in vegas
ham,Even if he my friend he is a priest call him now
spam,Hope you enjoyed your new content. text stop to 61610 to unsubscribe. help:08712400602450p Provided by tones2you.co.uk
ham,"That's fine, I'll bitch at you about it later then"
ham,I'm coming back on Thursday. Yay. Is it gonna be ok to get the money. Cheers. Oh yeah and how are you. Everything alright. Hows school. Or do you call it work now
ham,yes baby! I need to stretch open your pussy!
ham,No no. I will check all rooms befor activities
ham,I'm turning off my phone. My moms telling everyone I have cancer. And my sister won't stop calling. It hurts to talk. Can't put up with it. See u when u get home. Love u
ham,No need lar i go engin? Cos my sis at arts today...
ham,Did u find a sitter for kaitlyn? I was sick and slept all day yesterday.
ham,"Just checked out, heading out to drop off my stuff now"
spam,"As a valued customer, I am pleased to advise you that following recent review of your Mob No. you are awarded with a å£1500 Bonus Prize, call 09066368470"
spam,"WIN: We have a winner! Mr. T. Foley won an iPod! More exciting prizes soon, so keep an eye on ur mobile or visit www.win-82050.co.uk"
ham,Thats cool! Sometimes slow and gentle. Sonetimes rough and hard :)
ham,Yar... I tot u knew dis would happen long ago already.
ham,I will reach office around  &lt;DECIMAL&gt; . &amp; my mobile have problem. You cann't get my voice. So call you asa i'll free
ham,When is school starting. Where will you stay. What's the weather like. And the food. Do you have a social support system like friends in the school. All these things are important.
ham,You unbelievable faglord
ham,All will come alive.better correct any good looking figure there itself..
ham,"Just so that you know,yetunde hasn't sent money yet. I just sent her a text not to bother sending. So its over, you dont have to involve yourself in anything. I shouldn't have imposed anything on you in the first place so for that, i apologise."
ham,Play w computer? Aiyah i tok 2 u lor?
ham,Try to do something dear. You read something for exams
ham,U in town alone?
ham,"Em, its olowoyey@ usc.edu have a great time in argentina. Not sad about secretary, everything is a blessing"
ham,It didnt work again oh. Ok goodnight then. I.ll fix and have it ready by the time you wake up. You are very dearly missed have a good night sleep.
spam,"Today's Offer! Claim ur å£150 worth of discount vouchers! Text YES to 85023 now! SavaMob, member offers mobile! T Cs 08717898035. å£3.00 Sub. 16 . Unsub reply X"
ham,"Hmm, too many of them unfortunately... Pics obviously arent hot cakes. Its kinda fun tho"
ham,Ok . . now i am in bus. . If i come soon i will come otherwise tomorrow
ham,My birthday is on feb  &lt;#&gt;  da. .
ham,Hey i've booked the pilates and yoga lesson already... Haha
ham,That would be great. We'll be at the Guild. Could meet on Bristol road or somewhere - will get in touch over weekend. Our plans take flight! Have a good week
spam,We tried to contact you re your reply to our offer of a Video Phone 750 anytime any network mins Half Price Line Rental Camcorder Reply or call 08000930705
ham,"New Theory: Argument wins d SITUATION, but loses the PERSON. So dont argue with ur friends just.. . . . kick them &amp; say, I'm always correct.!"
ham,"Dear Hero,i am leaving to qatar tonite for an apt opportunity.pls do keep in touch at  &lt;EMAIL&gt; ,kerala"
ham,Don know:)this week i'm going to tirunelvai da.
ham,ÌÏ bot notes oredi... Cos i juz rem i got...
ham,Wah... Okie okie... Muz make use of e unlimited... Haha... 
ham,"Sir, I have been late in paying rent for the past few months and had to pay a $ &lt;#&gt;  charge. I felt it would be inconsiderate of me to nag about something you give at great cost to yourself and that's why i didnt speak up. I however am in a recession and wont be able to pay the charge this month hence my askin well ahead of month's end. Can you please help. Thanks"
ham,K:)all the best:)congrats...
ham,I'm done oredi...
ham,"My Parents, My Kidz, My Friends n My Colleagues. All screaming.. SURPRISE !! and I was waiting on the sofa.. ... ..... ' NAKED...!"
ham,Hope you are not scared!
ham,I want to see your pretty pussy...
ham,Neva mind it's ok..
ham,*deep sigh* ... I miss you :-( ... I am really surprised you haven't gone to the net cafe yet to get to me ... Don't you miss me?
ham,Customer place i will call you.
ham,Where are you ? You said you would be here when I woke ... :-(
ham,Up to Ì_... ÌÏ wan come then come lor... But i din c any stripes skirt...
ham,I have no idea where you are
ham,Thanks for being there for me just to talk to on saturday. You are very dear to me. I cherish having you as a brother and role model.
ham,Me too. Mark is taking forever to pick up my prescription and the pain is coming back.
ham,Huh so late... Fr dinner?
ham,"I don't know, same thing that's wrong everyso often, he panicks starts goin on bout not bein good enough Û_"
ham,Tell me again what your address is
ham,Am okay. Will soon be over. All the best
ham,Sounds like a plan! Cardiff is still here and still cold! I'm sitting on the radiator!
spam,"New Mobiles from 2004, MUST GO! Txt: NOKIA to No: 89545 & collect yours today! From ONLY å£1. www.4-tc.biz 2optout 087187262701.50gbp/mtmsg18 TXTAUCTION."
ham,"Can you tell Shola to please go to college of medicine and visit the academic department, tell the academic secretary what the current situation is and ask if she can transfer there. She should ask someone to check Sagamu for the same thing and lautech. Its vital she completes her medical education in Nigeria. Its less expensive much less expensive. Unless she will be getting citizen rates in new zealand."
spam,A å£400 XMAS REWARD IS WAITING FOR YOU! Our computer has randomly picked you from our loyal mobile customers to receive a å£400 reward. Just call 09066380611 
spam,"449050000301 You have won a å£2,000 price! To claim, call 09050000301."
ham,Aiyah ok wat as long as got improve can already wat...
ham,Ok...
ham,"I can probably come by, everybody's done around  &lt;#&gt;  right?"
ham,India have to take lead:)
ham,Am slow in using biola's fne
ham,Kind of. Took it to garage. Centre part of exhaust needs replacing. Part ordered n taking it to be fixed tomo morning.
ham,Did you see that film:)
ham,Yeah I can still give you a ride
spam,Had your mobile 11mths ? Update for FREE to Oranges latest colour camera mobiles & unlimited weekend calls. Call Mobile Upd8 on freefone 08000839402 or 2StopTxt
ham,Uncle Abbey! Happy New Year. Abiola
ham,"Awesome question with a cute answer: Someone asked a boy \how is ur life?\"" . . He smiled &amp; answered: . . \""She is fine!\"" Gudnite"""
ham,Ok lor...
spam,Hi 07734396839 IBH Customer Loyalty Offer: The NEW NOKIA6600 Mobile from ONLY å£10 at TXTAUCTION!Txt word:START to No:81151 & get Yours Now!4T&
ham,Very hurting n meaningful lines ever: \I compromised everything for my love
ham,"So anyways, you can just go to your gym or whatever, my love *smiles* I hope your ok and having a good day babe ... I miss you so much already"
spam,You are awarded a SiPix Digital Camera! call 09061221061 from landline. Delivery within 28days. T Cs Box177. M221BP. 2yr warranty. 150ppm. 16 . p på£3.99
ham,"If i let you do this, i want you in the house by 8am."
ham,Why don't you wait 'til at least wednesday to see if you get your .
ham,U too...
spam,Get your garden ready for summer with a FREE selection of summer bulbs and seeds worth å£33:50 only with The Scotsman this Saturday. To stop go2 notxt.co.uk
ham,That's good. Lets thank God. Please complete the drug. Have lots of water. And have a beautiful day.
ham,No. On the way home. So if not for the long dry spell the season would have been over
ham,Erm. I thought the contract ran out the4th of october.
ham,Booked ticket for pongal?
ham,Congratulations ore mo owo re wa. Enjoy it and i wish you many happy moments to and fro wherever you go
ham,"I noe la... U wana pei bf oso rite... K lor, other days den..."
ham,How long does applebees fucking take
ham,There is a first time for everything :)
ham,It's ok i wun b angry. Msg u aft i come home tonight.
ham,S:)s.nervous  &lt;#&gt; :)
ham,Yup ok...
ham,Hello. They are going to the village pub at 8 so either come here or there accordingly. Ok?
ham,"K, makes sense, btw carlos is being difficult so you guys are gonna smoke while I go pick up the second batch and get gas"
ham,Cos i was out shopping wif darren jus now n i called him 2 ask wat present he wan lor. Then he started guessing who i was wif n he finally guessed darren lor.
ham,Dear we got  &lt;#&gt;  dollars hi hi
ham,Me sef dey laugh you. Meanwhile how's my darling anjie!
ham,"Ya ok, then had dinner?"
ham,Wife.how she knew the time of murder exactly
ham,Ok give me 5 minutes I think I see her. BTW you're my alibi. You were cutting my hair the whole time.
spam,Please CALL 08712402578 immediately as there is an urgent message waiting for you
spam,"ou are guaranteed the latest Nokia Phone, a 40GB iPod MP3 player or a å£500 prize! Txt word: COLLECT to No: 83355! IBHltd LdnW15H 150p/Mtmsgrcvd18"
ham,Nothing just getting msgs by dis name wit different no's..
ham,Geeeee ... I love you so much I can barely stand it
ham,R Ì_ comin back for dinner?
ham,Hi there. We have now moved in2 our pub . Would be great 2 c u if u cud come up.
ham,I'm leaving my house now.
ham,Don't look back at the building because you have no coat and i don't want you to get more sick. Just hurry home and wear a coat to the gym!!!
spam,"Thanks for your ringtone order, reference number X49.Your mobile will be charged 4.50. Should your tone not arrive please call customer services 09065989182"
spam,"Had your contract mobile 11 Mnths? Latest Motorola, Nokia etc. all FREE! Double Mins & Text on Orange tariffs. TEXT YES for callback, no to remove from records."
ham,Sorry i cant take your call right now. It so happens that there r 2waxsto do wat you want. She can come and ill get her medical insurance. And she'll be able to deliver and have basic care. I'm currently shopping for the right medical insurance for her. So just give me til friday morning. Thats when i.ll see the major person that can guide me to the right insurance.
ham,They have a thread on the wishlist section of the forums where ppl post nitro requests. Start from the last page and collect from the bottom up.
ham,Happy new year. Hope you are having a good semester
spam,"New Tones This week include: 1)McFly-All Ab.., 2) Sara Jorge-Shock.. 3) Will Smith-Switch.. To order follow instructions on next message"
ham,"How long has it been since you screamed, princess?"
ham,I just cooked a rather nice salmon a la you
ham,East coast
spam,Hard LIVE 121 chat just 60p/min. Choose your girl and connect LIVE. Call 09094646899 now! Cheap Chat UK's biggest live service. VU BCM1896WC1N3XX
spam,25p 4 alfie Moon's Children in need song on ur mob. Tell ur m8s. Txt Tone charity to 8007 for Nokias or Poly charity for polys: zed 08701417012 profit 2 charity.
ham,Did u download the fring app?
ham,"life alle mone,eppolum oru pole allalo"
ham,Does daddy have a bb now.
ham,Then mum's repent how?
ham,Orh i tot u say she now still dun believe.
ham,The wine is flowing and i'm i have nevering..
ham,Huh so fast... Dat means u havent finished painting?
spam,5p 4 alfie Moon's Children in need song on ur mob. Tell ur m8s. Txt Tone charity to 8007 for Nokias or Poly charity for polys: zed 08701417012 profit 2 charity.
ham,Reason is if the team budget is available at last they buy the unsold players for at base rate..
ham,I might go 2 sch. Yar at e salon now v boring.
ham,Oh gei. That happend to me in tron. Maybe ill dl it in 3d when its out
ham,Ok... Then r we meeting later?
ham,Meeting u is my work. . . Tel me when shall i do my work tomorrow
ham,How are you. Its been ages. How's abj
ham,Were somewhere on Fredericksburg
ham,I cant pick the phone right now. Pls send a message
spam,Camera - You are awarded a SiPix Digital Camera! call 09061221066 fromm landline. Delivery within 28 days
ham,Maybe you should find something else to do instead???
spam,"Congrats! 1 year special cinema pass for 2 is yours. call 09061209465 now! C Suprman V, Matrix3, StarWars3, etc all 4 FREE! bx420-ip4-5we. 150pm. Dont miss out! "
ham,"Funny fact Nobody teaches volcanoes 2 erupt, tsunamis 2 arise, hurricanes 2 sway aroundn no 1 teaches hw 2 choose a wife Natural disasters just happens"
ham,I realise you are a busy guy and i'm trying not to be a bother. I have to get some exams outta the way and then try the cars. Do have a gr8 day
ham,U buy newspapers already?
ham,It certainly puts things into perspective when something like this happens
ham,Kindly send some one to our flat before  &lt;DECIMAL&gt;  today.
ham,Ya i knw u vl giv..its ok thanks kano..anyway enjoy wit ur family wit 1st salary..:-);-)
ham,PS U no ur a grown up now right?
ham,"Geeee ... I miss you already, you know ? Your all I can think about. Fuck, I can't wait till next year when we will be together ... *loving kiss*"
ham,ALRITE
ham,"Yar lor he wan 2 go c horse racing today mah, so eat earlier lor. I ate chicken rice. U?"
ham,U really pig leh sleep so much. My dad wake me up at 10 smth 2 eat lunch today.
ham,Cps is causing the outages to conserve energy.
