Label,Text
ham,Ok im not sure what time i finish tomorrow but i wanna spend the evening with you cos that would be vewy vewy lubly! Love me xxx
ham,I love you. You set my soul on fire. It is not just a spark. But it is a flame. A big rawring flame. XoXo
ham,Here got ur favorite oyster... N got my favorite sashimi... Ok lar i dun say already... Wait ur stomach start rumbling...
ham,I know you are serving. I mean what are you doing now.
spam,"Wan2 win a Meet+Greet with Westlife 4 U or a m8? They are currently on what tour? 1)Unbreakable, 2)Untamed, 3)Unkempt. Text 1,2 or 3 to 83049. Cost 50p +std text"
ham,Aiyah then i wait lor. Then u entertain me. Hee...
spam,88066 FROM 88066 LOST 3POUND HELP
ham,I know she called me
ham,Left dessert. U wan me 2 go suntec look 4 u?
ham,He also knows about lunch menu only da. . I know
ham,I cant pick the phone right now. Pls send a message
ham,Small problem in auction:)punj now asking tiwary
ham,IÛ÷ll have a look at the frying pan in case itÛ÷s cheap or a book perhaps. No thatÛ÷s silly a frying pan isnÛ÷t likely to be a book
ham,This is all just creepy and crazy to me.
ham,"House-Maid is the murderer, coz the man was murdered on  &lt;#&gt; th January.. As public holiday all govt.instituitions are closed,including post office..understand?"
ham,My house here e sky quite dark liao... If raining then got excuse not 2 run already rite... Hee...
ham,Hey gals.. Anyone of u going down to e driving centre tmr?
spam,"Thanks for your ringtone order, ref number K718. Your mobile will be charged å£4.50. Should your tone not arrive please call customer services on 09065069120"
ham,"Dont worry, 1 day very big lambu ji vl come..til then enjoy batchlor party:-)"
ham,In which place do you want da.
ham,Will Ì_ b going to esplanade fr home?
ham,I've reached sch already...
ham,"Me, i dont know again oh"
ham,"I've got  &lt;#&gt; , any way I could pick up?"
ham,"Hi this is yijue, can i meet u at 11 tmr?"
ham,"I.ll always be there, even if its just in spirit. I.ll get a bb soon. Just trying to be sure i need it."
ham,I don know account details..i will ask my mom and send you.my mom is out of reach now.
ham,Everybody had fun this evening. Miss you.
ham,Thats cool. i liked your photos. You are very sexy!
ham,Well good morning mr . Hows london treatin' ya treacle?
ham,Me hungry buy some food good lei... But mum n yun dun wan juz buy a little bit... 
spam,Ur cash-balance is currently 500 pounds - to maximize ur cash-in now send CASH to 86688 only 150p/msg. CC: 08718720201 PO BOX 114/14 TCR/W1
ham,Cheers for the message Zogtorius. IåÕve been staring at my phone for an age deciding whether to text or not.
ham,Today i'm not workin but not free oso... Gee... Thgt u workin at ur fren's shop ? 
ham,Wat r u doing?
ham,ÌÏ predict wat time Ì_'ll finish buying?
ham,Jus telling u dat i'll b leaving 4 shanghai on 21st instead so we'll haf more time 2 meet up cya...
spam,I am hot n horny and willing I live local to you - text a reply to hear strt back from me 150p per msg Netcollex LtdHelpDesk: 02085076972 reply Stop to end
spam,A link to your picture has been sent. You can also use http://alto18.co.uk/wave/wave.asp?o=44345
ham,"Hmm ok, i'll stay for like an hour cos my eye is really sore!"
ham,Ofcourse I also upload some songs
ham,"I'm an actor. When i work, i work in the evening and sleep late. Since i'm unemployed at the moment, i ALWAYS sleep late. When you're unemployed, every day is saturday."
ham,Nope. Meanwhile she talk say make i greet you.
ham,"Sorry, went to bed early, nightnight"
ham,Hey we can go jazz power yoga hip hop kb and yogasana 
ham,Slept? I thinkThis time ( &lt;#&gt;  pm) is not dangerous
ham,"Hey, a guy I know is breathing down my neck to get him some bud, anyway you'd be able to get a half track to usf tonight?"
ham,"No idea, I guess we'll work that out an hour after we're supposed to leave since as usual nobody has any interest in figuring shit out before the last second"
ham,Please tell me not all of my car keys are in your purse
ham,"Yo, you around? Just got my car back"
ham,\Hey j! r u feeling any better
ham,Still in the area of the restaurant. Ill try to come back soon
ham,Awww dat is sweet! We can think of something to do he he! Have a nice time tonight ill probably txt u later cos im lonely :( xxx.
ham,"We have sent JD for Customer Service cum Accounts Executive to ur mail id, For details contact us"
ham,"Do you know why god created gap between your fingers..? So that, One who is made for you comes &amp; fills those gaps by holding your hand with LOVE..!"
ham,U 2.
ham,Never blame a day in ur life. Good days give u happiness. Bad days give u experience. Both are essential in life! All are Gods blessings! good morning.:
ham,"Love isn't a decision, it's a feeling. If we could decide who to love, then, life would be much simpler, but then less magical"
ham,Nt joking seriously i told
ham,IM LATE TELLMISS IM ON MY WAY
ham,Carlos is taking his sweet time as usual so let me know when you and patty are done/want to smoke and I'll tell him to haul ass
ham,Lol. Well quality aint bad at all so i aint complaining
ham,"Probably not, I'm almost out of gas and I get some cash tomorrow"
ham,Oic... I saw him too but i tot he din c me... I found a group liao...
ham,Hi here. have birth at on the  to  at 8lb 7oz. Mother and baby doing brilliantly.
ham,Or better still can you catch her and let ask her if she can sell  &lt;#&gt;  for me.
ham,"Good afternoon, my boytoy ... How are you feeling today ? Better I hope? Are you being my good boy? Are you my obedient, slave? Do you please your Queen?"
ham,I will vote for wherever my heart guides me
ham,Reverse is cheating. That is not mathematics.
ham,"\Life is nothing wen v get everything\"". But \""life is everything wen v miss something \"". Real value of people wil be realized only in their absence.... gud mrng"""
spam,Dear Subscriber ur draw 4 å£100 gift voucher will b entered on receipt of a correct ans. When was Elvis Presleys Birthday? TXT answer to 80062
ham,"I call you later, don't have network. If urgnt, sms me."
ham,"How's my loverboy doing ? What does he do that keeps him from coming to his Queen, hmmm ? Doesn't he ache to speak to me ? Miss me desparately ?"
ham,Ujhhhhhhh computer shipped out with address to sandiago and parantella lane. Wtf. Poop.
ham,Yeah no probs - last night is obviously catching up with you... Speak soon 
ham,Thats cool! I am a gentleman and will treat you with dignity and respect.
ham,Ambrith..madurai..met u in arun dha marrge..remembr?
ham,You could have seen me..i did't recognise you Face.:)
ham,I cant pick the phone right now. Pls send a message
ham,I know complain num only..bettr directly go to bsnl offc nd apply for it..
ham,I love to give massages. I use lots of baby oil... What is your fave position?
ham,"IåÕm cool ta luv but v.tired 2 cause i have been doin loads of planning all wk, we have got our social services inspection at the nursery! Take care & spk sn x."
ham,I wanted to ask Ì_ to wait 4 me to finish lect. Cos my lect finishes in an hour anyway.
ham,Tell me something. Thats okay.
ham,"No, its true..k,Do u knw dis no. &lt;#&gt; ?"
ham,What happen dear. Why you silent. I am tensed
ham,"Sweetheart, hope you are not having that kind of day! Have one with loads of reasons to smile. Biola"
ham,"The guy at the car shop who was flirting with me got my phone number from the paperwork and called and texted me. I'm nervous because of course now he may have my address. Should i call his boss and tell him, knowing this may get him fired?"
ham,Pick you up bout 7.30ish? What time are  and that going?
ham,Hi Petey!noiåÕm ok just wanted 2 chat coz avent spoken 2 u 4 a long time-hope ur doin alrite.have good nit at js love ya am.x
ham,Ok. But i finish at 6.
ham,Dai what this da.. Can i send my resume to this id.
ham,What Today-sunday..sunday is holiday..so no work..
ham,How abt making some of the pics bigger?
ham,Leave it de:-). Start Prepare for next:-)..
ham,Got but got 2 colours lor. One colour is quite light n e other is darker lor. Actually i'm done she's styling my hair now.
ham,Hope youåÕre not having too much fun without me!! see u tomorrow love jess x
ham,Where are you ? What are you doing ? Are yuou working on getting the pc to your mom's ? Did you find a spot that it would work ? I need you
ham,:-) :-)
ham,Company is very good.environment is terrific and food is really nice:)
ham,Gudnite....tc...practice going on
ham,Okay... We wait ah
spam,"HOT LIVE FANTASIES call now 08707509020 Just 20p per min NTT Ltd, PO Box 1327 Croydon CR9 5WB 0870..k"
ham,"Goodmorning, Today i am late for  &lt;#&gt; min."
ham,She's fine. Good to hear from you. How are you my dear? Happy new year oh.
ham,I don't know jack shit about anything or i'd say/ask something helpful but if you want you can pretend that I did and just text me whatever in response to the hypotheticalhuagauahahuagahyuhagga
ham,", how's things? Just a quick question."
ham,K. I will sent it again
ham,"Ask g or iouri, I've told the story like ten times already"
ham,Going thru a very different feeling.wavering decisions and coping up with the same is the same individual.time will heal everything i believe.
ham,Go fool dont cheat others ok
ham,Anything is valuable in only 2 situations: First- Before getting it... Second- After loosing it...
ham,"Whatever, juliana. Do whatever you want."
ham,But you were together so you should be thinkin about him
ham,Aight do you still want to get money
ham,it's really getting me down just hanging around.
ham,My phone
ham,"Me not waking up until 4 in the afternoon, sup"
ham,"I guess you could be as good an excuse as any, lol."
ham,Cuz ibored. And don wanna study
ham,Then u better go sleep.. Dun disturb u liao.. U wake up then msg me lor..
ham,"Sorry battery died, yeah I'm here"
spam,Check Out Choose Your Babe Videos @ sms.shsex.netUN fgkslpoPW fgkslpo
ham,That was random saw my old roomate on campus. He graduated
ham,Any way where are you and what doing.
ham,Its a big difference.  &lt;#&gt;  versus  &lt;#&gt;  every  &lt;#&gt; hrs
ham,Beautiful truth : Expression of the face could Be seen by everyone... But the depression of heart Could be understood only By the Loved ones.. Gud Ni8;-)
ham,"Maybe westshore or hyde park village, the place near my house?"
ham,"By march ending, i should be ready. But will call you for sure. The problem is that my capital never complete. How far with you. How's work and the ladies"
ham,Wait 2 min..stand at bus stop
ham,Hey i will be late ah... Meet you at 945+
ham,"Hi elaine, is today's meeting confirmed?"
ham,"New Theory: Argument wins d SITUATION, but loses the PERSON. So dont argue with ur friends just.. . . . kick them &amp; say, I'm always correct.!"
ham,"Thk shld b can... Ya, i wana go 4 lessons... Haha, can go for one whole stretch..."
spam,U have a secret admirer. REVEAL who thinks U R So special. Call 09065174042. To opt out Reply REVEAL STOP. 1.50 per msg recd. Cust care 07821230901
ham,Not course. Only maths one day one chapter with in one month we can finish.
ham,"I wonder how you got online, my love ? Had you gone to the net cafe ? Did you get your phone recharged ? Were you on a friends net ? I think of you, boytoy"
ham,I.ll hand her my phone to chat wit u
spam,"Rock yr chik. Get 100's of filthy films &XXX pics on yr phone now. rply FILTH to 69669. Saristar Ltd, E14 9YT 08701752560. 450p per 5 days. Stop2 cancel"
ham,I have lost 10 kilos as of today!
ham,Just seeing your missed call my dear brother. Do have a gr8 day.
ham,Purity of friendship between two is not about smiling after reading the forwarded message..Its about smiling just by seeing the name. Gud evng musthu
ham,I cant keep talking to people if am not sure i can pay them if they agree to price. So pls tell me what you want to really buy and how much you are willing to pay
spam,"For ur chance to win å£250 cash every wk TXT: PLAY to 83370. T's&C's www.music-trivia.net custcare 08715705022, 1x150p/wk."
ham,Hmm. Shall i bring a bottle of wine to keep us amused? Just joking! I'll still bring a bottle. Red or white? See you tomorrow
ham,"Especially since i talk about boston all up in my personal statement, lol! I woulda changed that if i had realized it said nyc! It says boston now."
ham,Can come my room but cannot come my house cos my house still messy... Haha...
ham,"Awesome, think we can get an 8th at usf some time tonight?"
ham,"Hi, my love! How goes that day? Fuck, this morning I woke and dropped my cell on the way down the stairs but it seems alright ... *phews* I miss you !"
ham,How will I creep on you now? ;_;
ham,Good night. Am going to sleep.
ham,"Ill call u 2mrw at ninish, with my address that icky American freek wont stop callin me 2 bad Jen k eh?"
ham,So that means you still think of teju
ham,Hi baby ive just got back from work and i was wanting to see u allday! I hope i didnt piss u off on the phone today. If u are up give me a call xxx
ham,Am surfing online store. For offers do you want to buy any thing.
ham,Then ur sis how?
ham,Stupid.its not possible
ham,Depends on individual lor e hair dresser say pretty but my parents say look gong. U kaypoh.. I also dunno wat she collecting.
ham,"Thanx 4 the time weåÕve spent 2geva, its bin mint! Ur my Baby and all I want is u!xxxx"
ham,Wish u many many returns of the day.. Happy birthday vikky..
ham,Wa... U so efficient... Gee... Thanx...
ham,"Probably, want to pick up more?"
ham,"Hello my boytoy ... Geeee I miss you already and I just woke up. I wish you were here in bed with me, cuddling me. I love you ..."
ham,Ard 515 like dat. Y?
spam,Get ur 1st RINGTONE FREE NOW! Reply to this msg with TONE. Gr8 TOP 20 tones to your phone every week just å£1.50 per wk 2 opt out send STOP 08452810071 16
ham,Today iZ Yellow rose day. If u love my frndship give me 1 misscall &amp; send this to ur frndZ &amp; See how many miss calls u get. If u get 6missed U marry ur Lover.
ham,"Watching cartoon, listening music &amp; at eve had to go temple &amp; church.. What about u?"
ham,Thanx but my birthday is over already.
ham,"I've not called you in a while. This is hoping it was l8r malaria and that you know that we miss you guys. I miss Bani big, so pls give her my love especially. Have a great day."
ham,Going to take your babe out ?
ham,Wylie update: my weed dealer carlos went to freedom and had a class with lunsford
ham,R u saying i should re order the slippers cos i had to pay for returning it.
ham,I want snow. It's just freezing and windy.
ham,Well keep in mind I've only got enough gas for one more round trip barring a sudden influx of cash
ham,No I'm in the same boat. Still here at my moms. Check me out on yo. I'm half naked.
spam,"You are being contacted by our dating service by someone you know! To find out who it is, call from a land line 09050000878. PoBox45W2TG150P"
spam,Adult 18 Content Your video will be with you shortly
spam,Are you unique enough? Find out from 30th August. www.areyouunique.co.uk
ham,I dont want to hear anything
ham,Never blame a day in ur life. Good days give u happiness. Bad days give u experience. Both are essential in life! All are Gods blessings! good morning.:
ham,"ItÛ÷s reassuring, in this crazy world."
ham,Gudnite....tc...practice going on
ham,DonÛ÷t give a flying monkeys wot they think and I certainly donÛ÷t mind. Any friend of mine and all that!
ham,"I'm not sure, I was just checking out what was happening around the area"
ham,At WHAT TIME should i come tomorrow
ham,What is the plural of the noun research?
ham,"Yeah there's quite a bit left, I'll swing by tomorrow when I get up"
ham,U dun say so early hor... U c already then say...
ham,I was slept that time.you there?
ham,Nt yet chikku..simple habba..hw abt u?
ham,ARE YOU IN TOWN? THIS IS V. IMPORTANT
ham,"Sorry, I'll call later"
ham,They released vday shirts and when u put it on it makes your bottom half naked instead of those white underwear.
spam,FROM 88066 LOST å£12 HELP
ham,No problem with the renewal. I.ll do it right away but i dont know his details.
ham,If u sending her home first it's ok lor. I'm not ready yet.
ham,Love it! I want to flood that pretty pussy with cum...
ham,Ok i msg u b4 i leave my house.
ham,No..jst change tat only..
ham,We r outside already.
ham,U wake up already? Thanx 4 e tau sar piah it's quite nice.
spam,From next month get upto 50% More Calls 4 Ur standard network charge 2 activate Call 9061100010 C Wire3.net 1st4Terms PoBox84 M26 3UZ Cost å£1.50 min MobcudB more
ham,In that case I guess I'll see you at campus lodge
ham,Happy birthday... May all ur dreams come true...
ham,I can't describe how lucky you are that I'm actually awake by noon
ham,SORRY IM STIL FUCKED AFTER LAST NITE WENT TOBED AT 430 GOT UP 4 WORK AT 630
ham,Thank u. IT BETTER WORK OUT CAUSE I WILL FEEL USED OTHERWISE
ham,No. But we'll do medical missions to nigeria
ham,Yoyyooo u know how to change permissions for a drive in mac. My usb flash drive
ham,ALRITE SAM ITS NIC JUST CHECKIN THAT THIS IS UR NUMBER-SO IS IT?T.B*
ham,Nite...
ham,Lmao!nice 1
ham,Somebody set up a website where you can play hold em using eve online spacebucks
ham,"Dear Sir,Salam Alaikkum.Pride and Pleasure meeting you today at the Tea Shop.We are pleased to send you our contact number at Qatar.Rakhesh an Indian.Pls save our Number.Respectful Regards."
ham,Who were those people ? Were you in a tour ? I thought you were doing that sofa thing you sent me ? Your curious sugar
ham,"I'm home, my love ... If your still awake ... *loving kiss*"
ham,"I'm not coming over, do whatever you want"
ham,"Yeah why not, is the gang all ready"
ham,"Call me when you/carlos is/are here, my phone's vibrate is acting up and I might not hear texts"
ham,Tell me pa. How is pain de.
ham,"How about clothes, jewelry, and trips?"
ham,I am late. I will be there at
ham,"see you then, we're all christmassy here!"
ham,When should I come over?
spam,Reminder: You have not downloaded the content you have already paid for. Goto http://doit. mymoby. tv/ to collect your content.
ham,MAYBE IF YOU WOKE UP BEFORE FUCKING 3 THIS WOULDN'T BE A PROBLEM.
ham,Y lei?
spam,Urgent! Please call 09061213237 from landline. å£5000 cash or a luxury 4* Canary Islands Holiday await collection. T&Cs SAE PO Box 177. M227XY. 150ppm. 16+
ham,We will meet soon princess! Ttyl!
spam,Cashbin.co.uk (Get lots of cash this weekend!) www.cashbin.co.uk Dear Welcome to the weekend We have got our biggest and best EVER cash give away!! These..
spam,This message is brought to you by GMW Ltd. and is not connected to the
ham,I keep ten rs in my shelf:) buy two egg.
ham,I'm always on yahoo messenger now. Just send the message to me and i.ll get it you may have to send it in the mobile mode sha but i.ll get it. And will reply.
ham,Sounds great! Are you home now?
ham,"Honeybee Said: *I'm d Sweetest in d World* God Laughed &amp; Said: *Wait,U Havnt Met d Person Reading This Msg* MORAL: Even GOD Can Crack Jokes! GM+GN+GE+GN:)"
ham,Yar but they say got some error.
ham,I dont know oh. Hopefully this month.
ham,I am waiting machan. Call me once you free.
ham,Those cocksuckers. If it makes you feel better ipads are worthless garbage novelty items and you should feel bad for even wanting one
ham,You can jot down things you want to remember later.
ham,Was gr8 to see that message. So when r u leaving? Congrats dear. What school and wat r ur plans.
ham,You were supposed to wake ME up &gt;:(
ham,Hope this text meets you smiling. If not then let this text give you a reason to smile. Have a beautiful day.
ham,"No my blankets are sufficient, thx"
ham,My planning usually stops at \find hella weed
ham,"Uh, heads up we don't have THAT much left"
ham,K.k.how is your business now?
ham,Yes... I trust u to buy new stuff ASAP so I can try it out
ham,"Haha, that was the first person I was gonna ask"
ham,Is ur lecture over?
ham,He says hi and to get your ass back to south tampa (preferably at a kegger)
ham,"Haven't found a way to get another app for your phone, eh ? Will you go to the net cafe ? Did you take that job? Geeee I need you babe. I crave to see you ..."
ham,\Its Ur luck to Love someone. Its Ur fortune to Love the one who Loves U. But
ham,"\NONE!NOWHERE IKNO DOESDISCOUNT!SHITINNIT\"""""
spam,"Congrats 2 mobile 3G Videophones R yours. call 09063458130 now! videochat wid ur mates, play java games, Dload polypH music, noline rentl. bx420. ip4. 5we. 150p"
ham,Where is that one day training:-)
spam,"Last Chance! Claim ur å£150 worth of discount vouchers today! Text SHOP to 85023 now! SavaMob, offers mobile! T Cs SavaMob POBOX84, M263UZ. å£3.00 Sub. 16"
spam,URGENT! Your Mobile number has been awarded with a å£2000 prize GUARANTEED. Call 09058094455 from land line. Claim 3030. Valid 12hrs only
spam,Ur cash-balance is currently 500 pounds - to maximize ur cash-in now send GO to 86688 only 150p/msg. CC: 08718720201 PO BOX 114/14 TCR/W1
ham,My sister going to earn more than me da.
ham,Oh yah... We never cancel leh... Haha 
ham,Hey so whats the plan this sat? 
ham,ÌÏ still got lessons?  ÌÏ in sch?
ham,Are you going to write ccna exam this week??
ham,Hey sathya till now we dint meet not even a single time then how can i saw the situation sathya.
ham,"Solve d Case : A Man Was Found Murdered On  &lt;DECIMAL&gt; . &lt;#&gt;  AfterNoon. 1,His wife called Police. 2,Police questioned everyone. 3,Wife: Sir,I was sleeping, when the murder took place. 4.Cook: I was cooking. 5.Gardener: I was picking vegetables. 6.House-Maid: I went 2 d post office. 7.Children: We went 2 play. 8.Neighbour: We went 2 a marriage. Police arrested d murderer Immediately. Who's It? Reply With Reason, If U r Brilliant."
ham,Yes i have. So that's why u texted. Pshew...missing you so much
ham,"As I entered my cabin my PA said, '' Happy B'day Boss !!''. I felt special. She askd me 4 lunch. After lunch she invited me to her apartment. We went there."
ham,No i am not having not any movies in my laptop
ham,Thanks for your message. I really appreciate your sacrifice. I'm not sure of the process of direct pay but will find out on my way back from the test tomorrow. I'm in class now. Do have a wonderful day.
ham,"Better than bb. If he wont use it, his wife will or them doctor"
ham,"Haha just kidding, papa needs drugs"
ham,Now? I'm going out 4 dinner soon..
ham,Nooooooo I'm gonna be bored to death all day. Cable and internet outage.
ham,Am watching house ÛÒ very entertaining ÛÒ am getting the whole hugh laurie thing ÛÒ even with the stick ÛÒ indeed especially with the stick.
ham,ok....take care.umma to you too...
spam,Camera - You are awarded a SiPix Digital Camera! call 09061221066 fromm landline. Delivery within 28 days.
spam,You have an important customer service announcement. Call FREEPHONE 0800 542 0825 now!
ham,Still at west coast... Haiz... ÌÏ'll take forever to come back...
ham,Will you come online today night
ham,The greatest test of courage on earth is to bear defeat without losing heart....gn tc
ham,Oh sorry please its over
ham,S.i'm watching it in live..
ham,"True. It is passable. And if you get a high score and apply for phd, you get 5years of salary. So it makes life easier."
ham,Erutupalam thandiyachu
ham,"Ok. Can be later showing around 8-8:30 if you want + cld have drink before. Wld prefer not to spend money on nosh if you don't mind, as doing that nxt wk."
ham,"Oh, i will get paid. The most outstanding one is for a commercial i did for Hasbro...in AUGUST! They made us jump through so many hoops to get paid. Still not."
ham,Company is very good.environment is terrific and food is really nice:)
spam,+123 Congratulations - in this week's competition draw u have won the å£1450 prize to claim just call 09050002311 b4280703. T&Cs/stop SMS 08718727868. Over 18 only 150ppm
ham,You'd like that wouldn't you? Jerk!
ham,"Like  &lt;#&gt; , same question"
ham,"Yeah, we can probably swing by once my roommate finishes up with his girl"
ham,Carry on not disturbing both of you
ham,I WILL CAL YOU SIR. In meeting
ham,Gud mrng dear hav a nice day
ham,"Just arrived, see you in a couple days &lt;3"
ham,Hi di is yijue we're meeting at 7 pm at esaplanade tonight.
ham,Haha... Yup hopefully  we will lose a few kg by mon. after hip hop can go orchard and weigh again
ham,I will reach ur home in  &lt;#&gt;  minutes
ham,Ahhh. Work. I vaguely remember that! What does it feel like? Lol
ham,Please ask mummy to call father
spam,"WELL DONE! Your 4* Costa Del Sol Holiday or å£5000 await collection. Call 09050090044 Now toClaim. SAE, TCs, POBox334, Stockport, SK38xh, Costå£1.50/pm, Max10mins"
ham,He is world famamus....
ham,I cant pick the phone right now. Pls send a message
ham,Auntie huai juan never pick up her phone
ham,Wat time do u wan 2 meet me later?
ham,"That's good, because I need drugs"
ham,"Same, I'm at my great aunts anniversary party in tarpon springs"
ham,Oh oh... Den muz change plan liao... Go back have to yan jiu again...
ham,Lol boo I was hoping for a laugh
spam,"09066362231 URGENT! Your mobile No 07xxxxxxxxx won a å£2,000 bonus caller prize on 02/06/03! this is the 2nd attempt to reach YOU! call 09066362231 ASAP!"
ham,"K, jason says he's gonna be around so I'll be up there around  &lt;#&gt;"
ham,"Sorry, I'll call later in meeting"
ham,Keep yourself safe for me because I need you and I miss you already and I envy everyone that see's you in real life
ham,Not getting anywhere with this damn job hunting over here!
ham,Lol yes. But it will add some spice to your day.
ham,"Dude u knw also telugu..thts gud..k, gud nyt.."
ham,Hi:)did you asked to waheeda fathima about leave?
