Label,Text
spam,"pdate_Now - Double mins and 1000 txts on Orange tariffs. Latest Motorola, SonyEricsson & Nokia & Bluetooth FREE! Call MobileUpd8 on 08000839402 or call2optout/!YHL"
ham,Midnight at the earliest
ham,Alex says he's not ok with you not being ok with it
ham,"Sorry, I'll call later"
ham,R u in this continent?
spam,important information 4 orange user . today is your lucky day!2find out why log onto http://www.urawinner.com THERE'S A FANTASTIC SURPRISE AWAITING YOU!
ham,"Isn't frnd a necesity in life? imagine urself witout a frnd.. hw'd u feel at ur colleg? wat'll u do wth ur cell? wat abt functions? thnk abt events espe'll cared, missed &amp; irritated u? 4wrd it to all those dear-loving frnds wthout whom u cant live.. I jst did it.. Takecare..:) GOODMORNING"
ham,Im done. Just studyn in library
spam,"Hi there, 2nights ur lucky night! Uve been invited 2 XCHAT, the Uks wildest chat! Txt CHAT to 86688 now! 150p/MsgrcvdHG/Suite342/2Lands/Row/W1J6HL LDN 18yrs"
ham,Its hard to believe things like this. All can say lie but think twice before saying anything to me.
ham,"I hope your alright babe? I worry that you might have felt a bit desparate when you learned the job was a fake ? I am here waiting when you come back, my love"
ham,At what time are you coming.
ham,"Yo, I'm at my parents' gettin cash. Good news: we picked up a downstem"
ham,Cbe is really good nowadays:)lot of shop and showrooms:)city is shaping good.
ham,I'm job profile seems like bpo..
ham,hanks lotsly!
ham,"Pity, * was in mood for that. So...any other suggestions?"
ham,Hi Dear Call me its urgnt. I don't know whats your problem. You don't want to work or if you have any other problem at least tell me. Wating for your reply.
ham,I am great princess! What are you thinking about me? :)
ham,"Just got some gas money, any chance you and the gang want to go on a grand nature adventure?"
ham,Quite late lar... Ard 12 anyway i wun b drivin...
ham,I am in a marriage function
spam,PRIVATE! Your 2003 Account Statement for shows 800 un-redeemed S. I. M. points. Call 08715203694 Identifier Code: 40533 Expires 31/10/04
ham,"Aight yo, dats straight dogg"
spam,Congratulations U can claim 2 VIP row A Tickets 2 C Blu in concert in November or Blu gift guaranteed Call 09061104276 to claim TS&Cs www.smsco.net costå£3.75max 
ham,I dont know what to do to come out of this so only am ask questions like this dont mistake me.
ham,Ok u can take me shopping when u get paid =D
ham,Nationwide auto centre (or something like that) on Newport road. I liked them there
ham,I'm at work. Please call
ham,Have you heard about that job? I'm going to that wildlife talk again tonight if u want2come. Its that2worzels and a wizzle or whatever it is?! 
spam,"Orange customer, you may now claim your FREE CAMERA PHONE upgrade for your loyalty. Call now on 0207 153 9996. Offer ends 14thMarch. T&C's apply. Opt-out availa"
ham,Btw regarding that we should really try to see if anyone else can be our 4th guy before we commit to a random dude
ham,"1.20 that call cost. Which i guess isnt bad. Miss ya, need ya, want ya, love ya"
ham,"Probably not, still going over some stuff here"
ham,"Spoke with uncle john today. He strongly feels that you need to sacrifice to keep me here. He's going to call you. When he does, i beg you to just listen. Dont make any promises or make it clear things are not easy. And i need you to please let us work things out. As long as i keep expecting help, my creativity will be stifled so pls just keep him happy, no promises on your part."
ham,oh ya... Got hip hop open. Haha i was thinking can go for jazz then zoom to cine... Actually tonight i'm free leh... And there's a kb lesson tonight
ham,Yo im right by yo work
ham,Did u got that persons story
ham,I'm okay. Chasing the dream. What's good. What are you doing next.
ham,"HI HUN! IM NOT COMIN 2NITE-TELL EVERY1 IM SORRY 4 ME, HOPE U AVA GOODTIME!OLI RANG MELNITE IFINK IT MITE B SORTED,BUT IL EXPLAIN EVERYTHIN ON MON.L8RS.x"
ham,Nice.nice.how is it working?
ham,Moji i love you more than words. Have a rich day
ham,Please da call me any mistake from my side sorry da. Pls da goto doctor.
ham,Tell your friends what you plan to do on Valentines day @ &lt;URL&gt;
ham,I dont know ask to my brother. Nothing problem some thing that. Just i told .
spam,PRIVATE! Your 2004 Account Statement for 07742676969 shows 786 unredeemed Bonus Points. To claim call 08719180248 Identifier Code: 45239 Expires
spam,"Final Chance! Claim ur å£150 worth of discount vouchers today! Text YES to 85023 now! SavaMob, member offers mobile! T Cs SavaMob POBOX84, M263UZ. å£3.00 Subs 16"
ham,Right it wasnt you who phoned it was someone with a number like yours!
ham,"Cool, we shall go and see, have to go to tip anyway. Are you at home, got something to drop in later? So lets go to town tonight! Maybe mum can take us in."
ham,Call to the number which is available in appointment. And ask to connect the call to waheed fathima.
ham,"Since when, which side, any fever, any vomitin."
ham,"A famous quote : when you develop the ability to listen to 'anything' unconditionally without losing your temper or self confidence, it means you are ......... 'MARRIED'"
spam,"Urgent -call 09066649731from Landline. Your complimentary 4* Ibiza Holiday or å£10,000 cash await collection SAE T&Cs PO BOX 434 SK3 8WP 150ppm 18+"
ham,"Yup, no need. I'll jus wait 4 e rain 2 stop."
spam,SMS SERVICES For your inclusive text credits pls gotto www.comuk.net login 3qxj9 unsubscribe with STOP no extra charge help 08702840625 comuk.220cm2 9AE
spam,Text PASS to 69669 to collect your polyphonic ringtones. Normal gprs charges apply only. Enjoy your tones
ham,Every monday..nxt week vl be completing..
ham,Dont worry. I guess he's busy.
ham,Lol great now im getting hungry.
ham,I will come to ur home now
ham,Aight ill get on fb in a couple minutes
ham,"Usf I guess, might as well take 1 car"
ham,"Just dropped em off, omw back now"
ham,There bold 2  &lt;#&gt; . Is that yours
ham,It's Ì© only $140 ard...Ìä rest all ard $180 at least...Which is Ì© price 4 Ì© 2 bedrm ($900)
ham,"Anyway I don't think I can secure anything up here, lemme know if you want me to drive down south and chill"
spam,LORD OF THE RINGS:RETURN OF THE KING in store NOW!REPLY LOTR by 2 June 4 Chance 2 WIN LOTR soundtrack CDs StdTxtRate. Reply STOP to end txts
ham,Hey i will be really pretty late... You want to go for the lesson first? I will join you. I'm only reaching tp mrt
ham,How r Ì_ going to send it to me?
ham,Oh...i asked for fun. Haha...take care. Ì_
ham,But my family not responding for anything. Now am in room not went to home for diwali but no one called me and why not coming. It makes me feel like died.
ham,"\The world suffers a lot... Not because of the violence of bad people. But because of the silence of good people!\"""
ham,U still havent got urself a jacket ah?
ham,"Night has ended for another day, morning has come in a special way. May you smile like the sunny rays and leaves your worries at the blue blue bay."
ham,Hello beautiful r u ok? I've kinda ad a row wiv and he walked out the pub?? I wanted a night wiv u Miss u 
ham,Am in film ill call you later.
ham,DO U WANT 2 MEET UP 2MORRO
ham,Shuhui say change 2 suntec steamboat? U noe where? Where r u now?
ham,"Very strange.  and  are watching the 2nd one now but i'm in bed. Sweet dreams, miss u "
ham,"I prefer my free days... Tues, wed, fri oso can... ÌÏ ask those workin lor..."
ham,"The world is running and i am still.maybe all are feeling the same,so be it.or i have to admit,i am mad.then where is the correction?or let me call this is life.and keep running with the world,may be u r also running.lets run."
ham,Onum ela pa. Normal than.
ham,"Okey doke. I'm at home, but not dressed cos laying around ill! Speak to you later bout times and stuff. "
spam,"To review and KEEP the fantastic Nokia N-Gage game deck with Club Nokia, go 2 www.cnupdates.com/newsletter. unsubscribe from alerts reply with the word OUT"
ham,Ok... C ya...
ham,Yup. Wun believe wat? U really neva c e msg i sent shuhui?
ham,K. I will sent it again
ham,Why i come in between you people
ham,Still i have not checked it da. . .
ham,"That's very rude, you on campus?"
ham,Thanx 4 e brownie it's v nice...
ham,You give us back my id proof and  &lt;#&gt;  rs. We wont allow you to work. We will come to your home within days
ham,Haha okay... Today weekend leh... 
spam,Do you want 750 anytime any network mins 150 text and a NEW VIDEO phone for only five pounds per week call 08002888812 or reply for delivery tomorrow
ham,Now press conference da:)
ham,"Nah I don't think he goes to usf, he lives around here though"
ham,Well there's a pattern emerging of my friends telling me to drive up and come smoke with them and then telling me that I'm a weed fiend/make them smoke too much/impede their doing other things so you see how I'm hesitant
ham,I'm meeting Darren...
spam,Want a new Video Phone? 750 anytime any network mins? Half price line rental free text for 3 months? Reply or call 08000930705 for free delivery
ham,"Good stuff, will do."
ham,What happen dear tell me
ham,How are you babes. Hope your doing ok. I had a shit nights sleep. I fell asleep at 5.IåÕm knackered and iåÕm dreading work tonight. What are thou upto tonight. X
ham,Thanx 4 2day! U r a goodmate I THINK UR RITE SARY! ASUSUAL!1 U CHEERED ME UP! LOVE U FRANYxxxxx
ham,Hmm...my uncle just informed me that he's paying the school directly. So pls buy food.
ham,You will be in the place of that man
spam,URGENT! Your Mobile number has been awarded a <UKP>2000 prize GUARANTEED. Call 09061790125 from landline. Claim 3030. Valid 12hrs only 150ppm
ham,Is there any training tomorrow?
ham,"Can you please ask macho what his price range is, does he want something new or used plus it he only interfued in the blackberry bold  &lt;#&gt;  or any bb"
spam,"Urgent! Please call 09066612661 from your landline, your complimentary 4* Lux Costa Del Sol holiday or å£1000 CASH await collection. ppm 150 SAE T&Cs James 28, EH74RR"
ham,"I'll text carlos and let you know, hang on"
spam,Bloomberg -Message center +447797706009 Why wait? Apply for your future http://careers. bloomberg.com
ham,Its a part of checking IQ
ham,ÌÏ no home work to do meh... 
ham,"Party's at my place at usf, no charge (but if you can contribute in any way it is greatly appreciated) and yeah, we got room for one more"
ham,"OH RITE. WELL IM WITH MY BEST MATE PETE, WHO I WENT OUT WITH 4 A WEEK+ NOW WERE 2GEVA AGAIN. ITS BEEN LONGER THAN A WEEK."
ham,Watch lor. I saw a few swatch one i thk quite ok. Ard 116 but i need 2nd opinion leh...
ham,Thanks  and ! Or bomb and date as my phone wanted to say! 
ham,IM REALY SOZ IMAT MY MUMS 2NITE WHAT ABOUT 2MORO 
spam,Please call our customer service representative on FREEPHONE 0808 145 4742 between 9am-11pm as you have WON a guaranteed å£1000 cash or å£5000 prize!
spam,"This weeks SavaMob member offers are now accessible. Just call 08709501522 for details! SavaMob, POBOX 139, LA3 2WU. Only å£1.50/week. SavaMob - offers mobile!"
spam,URGENT! We are trying to contact U. Todays draw shows that you have won a å£800 prize GUARANTEED. Call 09050001808 from land line. Claim M95. Valid12hrs only
ham,Just now saw your message.it k da:)
ham,Apo all other are mokka players only
ham,Jus finish watching tv... U?
spam,Great NEW Offer - DOUBLE Mins & DOUBLE Txt on best Orange tariffs AND get latest camera phones 4 FREE! Call MobileUpd8 free on 08000839402 NOW! or 2stoptxt T&Cs
spam,Sorry! U can not unsubscribe yet. THE MOB offer package has a min term of 54 weeks> pls resubmit request after expiry. Reply THEMOB HELP 4 more info
ham,"Hey babe, sorry i didn't get sooner. Gary can come and fix it cause he thinks he knows what it is but he doesn't go as far a Ptbo and he says it will cost  &lt;#&gt;  bucks. I don't know if it might be cheaper to find someone there ? We don't have any second hand machines at all right now, let me know what you want to do babe"
ham,Rofl betta invest in some  anti aging products
ham,"Piggy, r u awake? I bet u're still sleeping. I'm going 4 lunch now..."
ham,With my sis lor... We juz watched italian job.
ham,"Wishing you and your family Merry \X\"" mas and HAPPY NEW Year in advance.."""
spam,"HOT LIVE FANTASIES call now 08707509020 Just 20p per min NTT Ltd, PO Box 1327 Croydon CR9 5WB 0870 is a national rate call"
ham,No plans yet. What are you doing ?
ham, gonna let me know cos comes bak from holiday that day.  is coming. Don't4get2text me  number. 
spam,Here is your discount code RP176781. To stop further messages reply stop. www.regalportfolio.co.uk. Customer Services 08717205546
spam,"Urgent! call 09066350750 from your landline. Your complimentary 4* Ibiza Holiday or 10,000 cash await collection SAE T&Cs PO BOX 434 SK3 8WP 150 ppm 18+ "
ham,Then u go back urself lor...
ham,For my family happiness..
ham,When're you guys getting back? G said you were thinking about not staying for mcr
ham,Im good! I have been thinking about you...
ham,Ya:)going for restaurant..
ham,Havent still waitin as usual... ÌÏ come back sch oredi?
ham,meet you in corporation st outside gap Û_ you can see how my mind is working!
ham,Prepare to be pleasured :)
ham,"Arms fine, how's Cardiff and uni? "
ham,WHEN THE FIRST STRIKE IS A RED ONE. THE BIRD + ANTELOPE BEGIN TOPLAY IN THE FIELDOF SELFINDEPENDENCE BELIEVE THIS + THE FLOWER OF CONTENTION WILL GROW.RANDOM!
ham,Jus finish blowing my hair. U finish dinner already?
ham,Lol! Oops sorry! Have fun. 
ham,You got called a tool?
ham,Get ready to put on your excellent sub face :)
ham,They don't put that stuff on the roads to keep it from getting slippery over there?
spam,"Final Chance! Claim ur å£150 worth of discount vouchers today! Text YES to 85023 now! SavaMob, member offers mobile! T Cs SavaMob POBOX84, M263UZ. å£3.00 Subs 16"
spam,PRIVATE! Your 2004 Account Statement for 078498****7 shows 786 unredeemed Bonus Points. To claim call 08719180219 Identifier Code: 45239 Expires 06.05.05
ham,I got your back! Do you have any dislikes in bed?
ham,Dunno dat's wat he told me. Ok lor...
ham,Hey tmr maybe can meet you at yck
ham,Umma my life and vava umma love you lot dear
spam,FREE camera phones with linerental from 4.49/month with 750 cross ntwk mins. 1/2 price txt bundle deals also avble. Call 08001950382 or call2optout/J MF
ham,Dunno lei shd b driving lor cos i go sch 1 hr oni.
ham,Ok Chinese food on its way. When I get fat you're paying for my lipo.
ham,Jus finish my lunch on my way home lor... I tot u dun wan 2 stay in sch today...
ham,Was just about to ask. Will keep this one. Maybe that's why you didn't get all the messages we sent you on glo
ham,Dunno y u ask me.
ham,"So you think i should actually talk to him? Not call his boss in the morning? I went to this place last year and he told me where i could go and get my car fixed cheaper. He kept telling me today how much he hoped i would come back in, how he always regretted not getting my number, etc."
spam,Please call Amanda with regard to renewing or upgrading your current T-Mobile handset free of charge. Offer ends today. Tel 0845 021 3680 subject to T's and C's
ham,"Hmmm.... Mayb can try e shoppin area one, but forgot e name of hotel..."
ham,Lmao. Take a pic and send it to me.
ham,So why didnt you holla?
ham,Tell rob to mack his gf in the theater
ham,Why don't you go tell your friend you're not sure you want to live with him because he smokes too much then spend hours begging him to come smoke
ham,Hi dis is yijue i would be happy to work wif Ì_ all for gek1510...
spam,You have won a guaranteed å£200 award or even å£1000 cashto claim UR award call free on 08000407165 (18+) 2 stop getstop on 88222 PHP. RG21 4JX
ham,Was actually sleeping and still might when u call back. So a text is gr8. You rock sis. Will send u a text wen i wake.
ham,"No I'm good for the movie, is it ok if I leave in an hourish?"
ham,I'm ok. Will do my part tomorrow
ham,I just made some payments so dont have that much. Sorry. Would you want it fedex or the other way.
ham,somewhere out there beneath the pale moon light someone think in of u some where out there where dreams come true... goodnite &amp; sweet dreams
ham,"Just sent you an email ÛÒ to an address with incomm in it, is that right?"
ham,Babe ! What are you doing ? Where are you ? Who are you talking to ? Do you think of me ? Are you being a good boy? Are you missing me? Do you love me ?
ham,Ok lor... Or u wan me go look 4 u?
ham,"Feb  &lt;#&gt;  is \I LOVE U\"" day. Send dis to all ur \""VALUED FRNDS\"" evn me. If 3 comes back u'll gt married d person u luv! If u ignore dis u will lose ur luv 4 Evr"""
ham,I wait 4 Ì_ inside da car park...
ham,Is there any movie theatre i can go to and watch unlimited movies and just pay once?
spam,"Hello darling how are you today? I would love to have a chat, why dont you tell me what you look like and what you are in to sexy?"
ham,"Edison has rightly said, \A fool can ask more questions than a wise man can answer\"" Now you know why all of us are speechless during ViVa.. GM"
ham,cThen i thk shd b enuff.. Still got conclusion n contents pg n references.. I'll b doing da contents pg n cover pg..
ham,Lol u still feeling sick?
ham,"Call me. I m unable to cal. Lets meet bhaskar, and deep"
spam,Sexy Singles are waiting for you! Text your AGE followed by your GENDER as wither M or F E.G.23F. For gay men text your AGE followed by a G. e.g.23G.
ham,Then Ì_ come n pick me at 530 ar?
ham,Oh ho. Is this the first time u use these type of words
ham,HIYA COMIN 2 BRISTOL 1 ST WEEK IN APRIL. LES GOT OFF + RUDI ON NEW YRS EVE BUT I WAS SNORING.THEY WERE DRUNK! U BAK AT COLLEGE YET? MY WORK SENDS INK 2 BATH.
ham,What u talking bout early morning? It's almost noon where your at!
ham,Alright took the morphine. Back in yo.
ham,Of cos can lar i'm not so ba dao ok... 1 pm lor... Y u never ask where we go ah... I said u would ask on fri but he said u will ask today...
ham,Ok
ham,Mm i am on the way to railway
ham,Really dun bluff me leh... U sleep early too. Nite...
spam,Summers finally here! Fancy a chat or flirt with sexy singles in yr area? To get MATCHED up just reply SUMMER now. Free 2 Join. OptOut txt STOP Help08714742804
ham,How come?
ham,What is this 'hex' place you talk of? Explain!
ham,"Helloooo... Wake up..! \Sweet\"" \""morning\"" \""welcomes\"" \""You\"" \""Enjoy\"" \""This Day\"" \""with full of joy\"".. \""GUD MRNG\""."""
ham,Ok that's great thanx a lot.
ham,yeah sure thing mate haunt got all my stuff sorted but im going sound anyway promoting hex for .by the way who is this? dont know number. Joke
ham,Good Morning plz call me sir
ham,I'll talk to the others and probably just come early tomorrow then
ham,K..give back my thanks.
spam,"SIX chances to win CASH! From 100 to 20,000 pounds txt> CSH11 and send to 87575. Cost 150p/day, 6days, 16+ TsandCs apply Reply HL 4 info"
ham,Hey come online! Use msn... We are all there
ham,He's just gonna worry for nothing. And he won't give you money its no use.
ham,"Rose for red,red for blood,blood for heart,heart for u. But u for me.... Send tis to all ur friends.. Including me.. If u like me.. If u get back, 1-u r poor in relation! 2-u need some 1 to support 3-u r frnd 2 many 4-some1 luvs u 5+- some1 is praying god to marry u.:-) try it...."
ham,Boo I'm on my way to my moms. She's making tortilla soup. Yummmm
ham,So there's a ring that comes with the guys costumes. It's there so they can gift their future yowifes. Hint hint
ham,It means u could not keep ur words.
ham,"not that I know of, most people up here are still out of town"
ham,And he's apparently bffs with carly quick now
ham,"A boy was late 2 home. His father: \POWER OF FRNDSHIP\"""""
ham,Yup... Hey then one day on fri we can ask miwa and jiayin take leave go karaoke 
ham,"I can't, I don't have her number!"
ham,"K, if u bored up just come to my home.."
ham,"I'll see if I can swing by in a bit, got some things to take care of here firsg"
ham,Ok lor Ì_ reaching then message me.
ham,She.s fine. I have had difficulties with her phone. It works with mine. Can you pls send her another friend request.
ham,Thanx a lot 4 ur help!
ham,We are supposed to meet to discuss abt our trip... Thought xuhui told you? In the afternoon. Thought we can go for lesson after that
spam,"\For the most sparkling shopping breaks from 45 per person; call 0121 2025050 or visit www.shortbreaks.org.uk\"""""
ham,You bad girl. I can still remember them
ham,Otherwise had part time job na-tuition..
ham,Printer is cool. I mean groovy. Wine is groovying
ham,Ok... But they said i've got wisdom teeth hidden inside n mayb need 2 remove.
ham,Do u noe how 2 send files between 2 computers?
ham,Its a part of checking IQ
ham,I am thinking of going down to reg for pract lessons.. Flung my advance.. Haha wat time u going?
ham,Hey morning what you come to ask:-) pa...
ham,Is it ok if I stay the night here? Xavier has a sleeping bag and I'm getting tired
ham,Yes. Please leave at  &lt;#&gt; . So that at  &lt;#&gt;  we can leave
ham,"The LAY MAN! Just to let you know you are missed and thought off. Do have a great day. And if you can send me bimbo and ugo's numbers, ill appreciate. Safe"
ham,I was gonna ask you lol but i think its at 7
ham,Is ur paper in e morn or aft tmr?
spam,"Congratulations! Thanks to a good friend U have WON the å£2,000 Xmas prize. 2 claim is easy, just call 08718726978 NOW! Only 10p per minute. BT-national-rate"
ham,And now electricity just went out fml.
ham,"Nah, I'm a perpetual DD"
ham,"Don't Think About \What u Have Got\"" Think About \""How to Use It That You Have Got\"" gooD ni8"""
ham,Can you open the door?
ham,What * u wearing?
ham,What's the significance?
ham,"K I'm leaving soon, be there a little after 9"
ham,Are you angry with me. What happen dear
ham,But i haf enuff space got like 4 mb...
ham,Its like that hotel dusk game i think. You solve puzzles in a area thing
ham,"No, I decided that only people who care about stuff vote and caring about stuff is for losers"
spam,"Update_Now - Xmas Offer! Latest Motorola, SonyEricsson & Nokia & FREE Bluetooth! Double Mins & 1000 Txt on Orange. Call MobileUpd8 on 08000839402 or call2optout/F4Q="
ham,Haha... Really oh no... How? Then will they deduct your lesson tmr?
ham,K go and sleep well. Take rest:-).
ham,Lol your always so convincing.
ham,"Awesome, I remember the last time we got somebody high for the first time with diesel :V"
ham,Probably earlier than that if the station's where I think it is
ham,"Lol, oh you got a friend for the dog ?"
ham,Pls give her prometazine syrup. 5mls then  &lt;#&gt; mins later feed.
ham,I dont have any of your file in my bag..i was in work when you called me.i 'll tell you if i find anything in my room.
ham,Wanna do some art?! :D
ham,Okay lor... Wah... like that def they wont let us go... Haha... What did they say in the terms and conditions?
ham,Host-based IDPS for linux systems.
spam,Your credits have been topped up for http://www.bubbletext.com Your renewal Pin is tgxxrz
ham,Ok lor. I'm in town now lei.
ham,No need to say anything to me. I know i am an outsider
ham,i want to grasp your pretty booty :)
ham,"That means you got an A in epi, she.s fine. She.s here now."
ham,"U need my presnts always bcz U cant mis love. \jeevithathile irulinae neekunna prakasamanu sneham\"" prakasam ennal prabha 'That mns prabha is'LOVE' Got it. Dont mis me...."""
spam,"HOT LIVE FANTASIES call now 08707500020 Just 20p per min NTT Ltd, PO Box 1327 Croydon CR9 5WB 0870 is a national rate call"
ham,"I get out of class in bsn in like  &lt;#&gt;  minutes, you know where advising is?"
ham,"Sorry, I'll call later"
ham,"Same here, but I consider walls and bunkers and shit important just because I never play on peaceful but I guess your place is high enough that it don't matter"
spam,Our brand new mobile music service is now live. The free music player will arrive shortly. Just install on your phone to browse content from the top artists.
ham,Can u look 4 me in da lib i got stuff havent finish yet.
ham,Your gonna be the death if me. I'm gonna leave a note that says its all robs fault. Avenge me.
ham,Enjoy urself tmr...
spam,Camera - You are awarded a SiPix Digital Camera! call 09061221066 fromm landline. Delivery within 28 days.
spam,"As a SIM subscriber, you are selected to receive a Bonus! Get it delivered to your door, Txt the word OK to No: 88600 to claim. 150p/msg, EXP. 30Apr"
ham,No da. . Vijay going to talk in jaya tv
ham,That is wondarfull song
ham,We're on the opposite side from where we dropped you off
ham,how tall are you princess?
ham,I'm fine. Hope you are good. Do take care.
ham,From tomorrow onwards eve 6 to 3 work.
spam,"Auction round 4. The highest bid is now å£54. Next maximum bid is å£71. To bid, send BIDS e. g. 10 (to bid å£10) to 83383. Good luck."
ham,Oh unintentionally not bad timing. Great. Fingers  the trains play along! Will give fifteen min warning.
ham,If You mean the website. Yes.
ham,Its just the effect of irritation. Just ignore it
ham,Of course. I guess god's just got me on hold right now.
ham,You are right. Meanwhile how's project twins comin up
ham,"Sorry I flaked last night, shit's seriously goin down with my roommate, what you up to tonight?"
spam,Dear U've been invited to XCHAT. This is our final attempt to contact u! Txt CHAT to 86688
ham,1. Tension face 2. Smiling face 3. Waste face 4. Innocent face 5.Terror face 6.Cruel face 7.Romantic face 8.Lovable face 9.decent face  &lt;#&gt; .joker face.
ham,Hey are you angry with me. Reply me dr.
ham,K..k..any special today?
ham,I think just yourself Û_Thanks and see you tomo
