Label,Text
ham,NEFT Transaction with reference number  &lt;#&gt;  for Rs. &lt;DECIMAL&gt;  has been credited to the beneficiary account on  &lt;#&gt;  at  &lt;TIME&gt; : &lt;#&gt;
ham,"Once a fishrman woke early in d mrng. It was very dark. He waited a while &amp; found a sack ful of stones. He strtd throwin thm in2 d sea 2 pass time. Atlast he had jus 1stone, sun rose up &amp; he found out tht those r nt stones, those were diamonds. Moral:\Dont wake up early in d mrng'' GOOD night"""
ham,I know you mood off today
ham,What's up. Do you want me to come online?
ham,You will go to walmart. I.ll stay.
ham,Great! How is the office today?
ham,Hope you are having a great new semester. Do wish you the very best. You are made for greatness.
ham,Ugh I don't wanna get out of bed. It's so warm.
ham,So wat's da decision?
ham,I am in office:)whats the matter..msg me now.i will call you at break:).
ham,Sorry * was at the grocers.
ham,Hey what happen de. Are you alright.
ham,I've told him that i've returned it. That should i re order it.
ham,Lol no ouch but wish i'd stayed out a bit longer
ham,"It's that time of the week again, ryan"
spam,Double Mins & Double Txt & 1/2 price Linerental on Latest Orange Bluetooth mobiles. Call MobileUpd8 for the very latest offers. 08000839402 or call2optout/LF56
ham,"Yo, the game almost over? Want to go to walmart soon"
ham,"Ok., is any problem to u frm him? Wats matter?"
ham,Hahaha..use your brain dear
ham,MY NO. IN LUTON 0125698789 RING ME IF UR AROUND! H*
ham,"Get the door, I'm here"
ham,"Oh, yes, I've just been a little under the weather so i've kind of been coccooning at home"
ham,R U &SAM P IN EACHOTHER. IF WE MEET WE CAN GO 2 MY HOUSE
ham,Neshanth..tel me who r u?
spam,"Want to funk up ur fone with a weekly new tone reply TONES2U 2 this text. www.ringtones.co.uk, the original n best. Tones 3GBP network operator rates apply"
spam,Loans for any purpose even if you have Bad Credit! Tenants Welcome. Call NoWorriesLoans.com on 08717111821
ham,"Im sorry bout last nite it wasnåÕt ur fault it was me, spouse it was pmt or sumthin! U 4give me? I think u shldxxxx"
ham,"Gosh that , what a pain. Spose I better come then."
ham,I've been barred from all B and Q stores for life!?This twat in orange dungerees came up to me and asked if I wanted decking? So I got the first punch in!!
ham,Then u going ikea str aft dat?
ham,"Haha yeah I see that now, be there in a sec"
ham,S:)8 min to go for lunch:)
ham,I probably won't eat at all today. I think I'm gonna pop. How was your weekend? Did u miss me?
ham,"Nothing really, just making sure everybody's up to speed"
ham,Do Ì_ all wan 2 meet up n combine all the parts? How's da rest of da project going?
ham,The whole car appreciated the last two! Dad and are having a map reading semi argument but apart from that things are going ok. P.
ham,"We know TAJ MAHAL as symbol of love. But the other lesser known facts 1. Mumtaz was Shahjahan's 4th wife, out of his 7 wifes. 2. Shahjahan killed Mumtaz's husband to marry her. 3. Mumtaz died in her  &lt;#&gt; th delivery. 4. He then married Mumtaz's sister. Question arises where the Hell is the LOVE?:-| -The Great Hari-"
ham,;-) ok. I feel like john lennon.
ham,God bless.get good sleep my dear...i will pray!
ham,Do we have any spare power supplies
ham,At 7 we will go ok na.
ham,"Aight that'll work, thanks"
ham,No I don't have cancer. Moms making a big deal out of a regular checkup aka pap smear
spam,Our records indicate u maybe entitled to 5000 pounds in compensation for the Accident you had. To claim 4 free reply with CLAIM to this msg. 2 stop txt STOP
ham,Can you say what happen
ham,K.k:)i'm going to tirunelvali this week to see my uncle ..i already spend the amount by taking dress .so only i want money.i will give it on feb 1
ham,"Sorry light turned green, I meant another friend wanted  &lt;#&gt;  worth but he may not be around"
ham,"Watching cartoon, listening music &amp; at eve had to go temple &amp; church.. What about u?"
ham,"(No promises on when though, haven't even gotten dinner yet)"
ham,I've sent my wife your text. After we buy them she'll tell you what to do. So just relax. We should go get them this wkend.
spam,500 free text msgs. Just text ok to 80488 and we'll credit your account
ham,"Aight fuck it, I'll get it later"
ham,Water logging in desert. Geoenvironmental implications.
ham,So your telling me I coulda been your real Valentine and I wasn't? U never pick me for NOTHING!!
ham,"I'm back &amp; we're packing the car now, I'll let you know if there's room"
ham,I will send them to your email. Do you mind  &lt;#&gt;  times per night?
ham,Fyi I'm gonna call you sporadically starting at like  &lt;#&gt;  bc we are not not doin this shit
ham,Hey! There's veggie pizza... :/
ham,Same to u...
ham,That's ok. I popped in to ask bout something and she said you'd been in. Are you around tonght wen this girl comes?
ham,Kaiez... Enjoy ur tuition... Gee... Thk e second option sounds beta... I'll go yan jiu den msg u...
spam,"This is the 2nd attempt to contract U, you have won this weeks top prize of either å£1000 cash or å£200 prize. Just call 09066361921"
spam,"tddnewsletter@emc1.co.uk (More games from TheDailyDraw) Dear Helen, Dozens of Free Games - with great prizesWith.."
ham,Uhhhhrmm isnt having tb test bad when youre sick
ham,I think that tantrum's finished so yeah I'll be by at some point
spam,Burger King - Wanna play footy at a top stadium? Get 2 Burger King before 1st Sept and go Large or Super with Coca-Cola and walk out a winner
ham,Update your face book status frequently :)
ham,Nope wif my sis lor... Aft bathing my dog then i can bathe... Looks like it's going 2 rain soon.
ham,We are both fine. Thanks
ham,If u dun drive then how i go 2 sch.
ham,"Yalru lyfu astne chikku.. Bt innu mundhe lyf ali halla ke bilo (marriage)program edhae, so lyf is nt yet ovr chikku..ali vargu lyfu meow meow:-D"
ham,I'm in office now . I will call you  &lt;#&gt;  min:)
ham,Well its not like you actually called someone a punto. That woulda been worse.
spam,Guess what! Somebody you know secretly fancies you! Wanna find out who it is? Give us a call on 09065394514 From Landline DATEBox1282EssexCM61XN 150p/min 18
ham,Smile in Pleasure Smile in Pain Smile when trouble pours like Rain Smile when sum1 Hurts U Smile becoz SOMEONE still Loves to see u Smiling!!
ham,Thanks chikku..:-) gud nyt:-*
ham,Oh ok.. Wat's ur email?
ham,Dont let studying stress you out. L8r.
ham,PICK UR FONE UP NOW U DUMB?
ham,"I call you later, don't have network. If urgnt, sms me."
ham,I will spoil you in bed as well :)
ham,No calls..messages..missed calls
spam,Congratulations YOU'VE Won. You're a Winner in our August å£1000 Prize Draw. Call 09066660100 NOW. Prize Code 2309.
ham,Nope... Juz off from work...
ham,Babe ? I lost you ... Will you try rebooting ?
ham,"swhrt how u dey,hope ur ok, tot about u 2day.love n miss.take care."
ham,"No dice, art class 6 thru 9 :( thanks though. Any idea what time I should come tomorrow?"
ham,Book which lesson? then you msg me... I will call up after work or sth... I'm going to get specs. My membership is PX3748
ham,"Lemme know when I can swing by and pick up, I'm free basically any time after 1 all this semester"
ham,What he said is not the matter. My mind saying some other matter is there.
spam,WIN URGENT! Your mobile number has been awarded with a å£2000 prize GUARANTEED call 09061790121 from land line. claim 3030 valid 12hrs only 150ppm 
ham,But i'm really really broke oh. No amount is too small even  &lt;#&gt; 
ham,"Rose for red,red for blood,blood for heart,heart for u. But u for me.... Send tis to all ur friends.. Including me.. If u like me.. If u get back, 1-u r poor in relation! 2-u need some 1 to support 3-u r frnd 2 many 4-some1 luvs u 5+- some1 is praying god to marry u.:-) try it...."
ham,"K.. I yan jiu liao... Sat we can go 4 bugis vill one frm 10 to 3 den hop to parco 4 nb. Sun can go cine frm 1030 to 2, den hop to orc mrt 4 hip hop at 4..."
ham,When can Ì_ come out?
ham,I cant pick the phone right now. Pls send a message
ham,U sick still can go shopping?
ham,Have a great trip to India. And bring the light to everyone not just with the project but with everyone that is lucky to see you smile. Bye. Abiola
ham,"Please protect yourself from e-threats. SIB never asks for sensitive information like Passwords,ATM/SMS PIN thru email. Never share your password with anybody."
ham,Misplaced your number and was sending texts to your old number. Wondering why i've not heard from you this year. All the best in your mcat. Got this number from my atlanta friends
ham,Do you think i can move  &lt;#&gt;  in a week
ham,Do you want bold 2 or bb torch
ham,Are you not around or just still asleep? :V
ham,Hey what are you doing. Y no reply pa..
ham,You flippin your shit yet?
ham,Hey you still want to go for yogasana? Coz if we end at cine then can go bathe and hav the steam bath
ham,Eh sorry leh... I din c ur msg. Not sad already lar. Me watching tv now. U still in office?
ham,Gud ni8 dear..slp well..take care..swt dreams..Muah..
ham,"Night has ended for another day, morning has come in a special way. May you smile like the sunny rays and leaves your worries at the blue blue bay. Gud mrng"
ham,No message..no responce..what happend?
ham,Speaking of does he have any cash yet?
ham,"I don't think I can get away for a trek that long with family in town, sorry"
ham,"There'll be a minor shindig at my place later tonight, you interested?"
ham,Sindu got job in birla soft ..
ham,Yeah whatever lol
ham,"Cool, what time you think you can get here?"
ham,"Text me when you get off, don't call, my phones having problems"
spam,You have WON a guaranteed å£1000 cash or a å£2000 prize. To claim yr prize call our customer service representative on 08714712412 between 10am-7pm Cost 10p
spam,"Hi this is Amy, we will be sending you a free phone number in a couple of days, which will give you an access to all the adult parties..."
ham,"\Speak only when you feel your words are better than the silence...\"" Gud mrng:-)"""
ham,Captain is in our room:)
spam,"This is the 2nd time we have tried 2 contact u. U have won the 750 Pound prize. 2 claim is easy, call 08712101358 NOW! Only 10p per min. BT-national-rate"
ham,Jokin only lar... :-) depends on which phone my father can get lor...
spam,Ur cash-balance is currently 500 pounds - to maximize ur cash-in now send COLLECT to 83600 only 150p/msg. CC: 08718720201 PO BOX 114/14 TCR/W1
spam,PRIVATE! Your 2003 Account Statement for 07753741225 shows 800 un-redeemed S. I. M. points. Call 08715203677 Identifier Code: 42478 Expires 24/10/04
ham,"IÛ÷ve got some salt, you can rub it in my open wounds if you like!"
ham,If I get there before you after your ten billion calls and texts so help me god
ham,ok. I am a gentleman and will treat you with dignity and respect.
ham,"It could work, we'll reach a consensus at the next meeting"
ham,"Can you pls pls send me a mail on all you know about relatives coming to deliver here? All you know about costs, risks, benefits and anything else. Thanks."
ham,I will come tomorrow di
spam,"Bored of speed dating? Try SPEEDCHAT, txt SPEEDCHAT to 80155, if you don't like em txt SWAP and get a new chatter! Chat80155 POBox36504W45WQ 150p/msg rcd 16"
spam,Warner Village 83118 C Colin Farrell in SWAT this wkend @Warner Village & get 1 free med. Popcorn!Just show msg+ticket@kiosk.Valid 4-7/12. C t&c @kiosk. Reply SONY 4 mre film offers
ham,Yes. I come to nyc for audiitions and am trying to relocate.
ham,When u wana see it then
ham,"Aight, I'll ask a few of my roommates"
ham,"Er, hello, things didnÛ÷t quite go to plan ÛÒ is limping slowly home followed by aa and with exhaust hanging off"
ham,Mmmm.... I cant wait to lick it!
ham,when you and derek done with class?
ham,Gud mrng dear hav a nice day
ham,Your opinion about me? 1. Over 2. Jada 3. Kusruthi 4. Lovable 5. Silent 6. Spl character 7. Not matured 8. Stylish 9. Simple Pls reply..
ham,Yes I posted a couple of pics on fb. There's still snow outside too. I'm just waking up :)
spam,"Free-message: Jamster!Get the crazy frog sound now! For poly text MAD1, for real text MAD2 to 88888. 6 crazy sounds for just 3 GBP/week! 16+only! T&C's apply"
ham,"Yo, any way we could pick something up tonight?"
ham,"Uncle G, just checking up on you. Do have a rewarding month"
spam,"URGENT! You have won a 1 week FREE membership in our å£100,000 Prize Jackpot! Txt the word: CLAIM to No: 81010 T&C www.dbuk.net LCCLTD POBOX 4403LDNW1A7RW18"
ham,Nope... C Ì_ then...
spam,Had your mobile 11 months or more? U R entitled to Update to the latest colour mobiles with camera for Free! Call The Mobile Update Co FREE on 08002986030
spam,TBS/PERSOLVO. been chasing us since Sept forå£38 definitely not paying now thanks to your information. We will ignore them. Kath. Manchester.
ham,Yes:)from last week itself i'm taking live call.
ham,So that takes away some money worries
spam,Todays Voda numbers ending 5226 are selected to receive a ?350 award. If you hava a match please call 08712300220 quoting claim code 1131 standard rates app 
ham,Y dun cut too short leh. U dun like ah? She failed. She's quite sad.
ham,Yes :)it completely in out of form:)clark also utter waste.
ham,Shall i come to get pickle
ham,Ok . . now i am in bus. . If i come soon i will come otherwise tomorrow
ham,Shall I bring us a bottle of wine to keep us amused? Only joking! IÛ÷ll bring one anyway
ham,Just taste fish curry :-P
spam,Double Mins & Double Txt & 1/2 price Linerental on Latest Orange Bluetooth mobiles. Call MobileUpd8 for the very latest offers. 08000839402 or call2optout/LF56
ham,"Ever green quote ever told by Jerry in cartoon \A Person Who Irritates u Always Is the one Who Loves u Vry Much But Fails to Express It...!..!! :-) :-) gud nyt"""
spam,"SMS. ac Blind Date 4U!: Rodds1 is 21/m from Aberdeen, United Kingdom. Check Him out http://img. sms. ac/W/icmb3cktz8r7!-4 no Blind Dates send HIDE"
ham,Cab is available.they pick up and drop at door steps.
ham,"Under the sea, there lays a rock. In the rock, there is an envelope. In the envelope, there is a paper. On the paper, there are 3 words... '"
ham,Just do what ever is easier for you
ham,"Hello, yeah i've just got out of the bath and need to do my hair so i'll come up when i'm done, yeah?"
ham,"Like I made him throw up when we were smoking in our friend's car one time, it was awesome"
ham,"What do u reckon as need 2 arrange transport if u can't do it, thanks"
spam,"Customer service announcement. We recently tried to make a delivery to you but were unable to do so, please call 07090298926 to re-schedule. Ref:9307622"
ham,Did u receive my msg?
ham,"The  &lt;#&gt; g that i saw a few days ago, the guy wants sell wifi only for  &lt;#&gt;  and with 3g for  &lt;#&gt; . That's why i blanked him."
ham,A little. Meds say take once every 8 hours. It's only been 5 but pain is back. So I took another. Hope I don't die
ham,Got smaller capacity one? Quite ex...
spam,Email AlertFrom: Jeri StewartSize: 2KBSubject: Low-cost prescripiton drvgsTo listen to email call 123
ham,"Vikky, come around  &lt;TIME&gt; .."
ham,Are you ok. What happen to behave like this
ham,I want to tell you how bad I feel that basically the only times I text you lately are when I need drugs
ham,Oh just getting even with u.... u?
ham,I can't make it tonight
spam,"Eerie Nokia tones 4u, rply TONE TITLE to 8007 eg TONE DRACULA to 8007 Titles: GHOST, ADDAMSFA, MUNSTERS, EXORCIST, TWILIGHT www.getzed.co.uk POBox36504W45WQ 150p "
ham,I told that am coming on wednesday.
ham,Fine. Do you remember me.
ham,Now that you have started dont stop. Just pray for more good ideas and anything i see that can help you guys i.ll forward you a link.
ham,No de.am seeing in online shop so that i asked.
ham,"Sorry, I'll call later"
ham,No:-)i got rumour that you going to buy apartment in chennai:-)
ham,U can call me now...
ham,No problem. We will be spending a lot of quality time together...
ham,"Sometimes we put walls around our hearts,not just to be safe from getting hurt.. But to find out who cares enough to break the walls &amp; get closer.. GOODNOON:)"
ham,"Also sir, i sent you an email about how to log into the usc payment portal. I.ll send you another message that should explain how things are back home. Have a great weekend."
ham,Sos! Any amount i can get pls.
ham,Crazy ar he's married. ÌÏ like gd looking guys not me. My frens like say he's korean leona's fave but i dun thk he is. Aft some thinking mayb most prob i'll go.
ham,"naughty little thought: 'its better to flirt, flirt n flirt, rather than loving someone n gettin hurt, hurt n hurt...:-) Gud nyt"
ham,If u laugh really loud.. If u talk spontaneously.. If u dont care what others feel.. U are probably with your dear &amp; best friends.. GOODEVENING Dear..:)
spam,You are now unsubscribed all services. Get tons of sexy babes or hunks straight to your phone! go to http://gotbabes.co.uk. No subscriptions.
ham,A bloo bloo bloo I'll miss the first bowl
ham,Oh god..taken the teeth?is it paining
ham,How are you with moneY...as in to you...money aint a thing....how are you sha!
ham,"If e timing can, then i go w u lor..."
ham,First answer my question.
ham,Bull. Your plan was to go floating off to IKEA with me without a care in the world. So i have to live with your mess another day.
ham,"K, wat s tht incident?"
ham,"It'll be tough, but I'll do what I have to"
ham,Have you finished work yet? :)
ham,"Dizzamn, aight I'll ask my suitemates when I get back"
ham,Wow didn't think it was that common. I take it all back ur not a freak! Unless u chop it off:-)
spam,"Congratulations! Thanks to a good friend U have WON the å£2,000 Xmas prize. 2 claim is easy, just call 08718726971 NOW! Only 10p per minute. BT-national-rate."
ham,No no. I will check all rooms befor activities
ham,"* Was really good to see you the other day dudette, been missing you!"
ham,What you thinked about me. First time you saw me in class.
ham,Yunny i'm walking in citylink now Ì_ faster come down... Me very hungry...
ham,Oh... Lk tt den we take e one tt ends at cine lor... Dun wan yogasana oso can... 
ham,"Hello.How u doing?What u been up 2?When will u b moving out of the flat, cos I will need to arrange to pick up the lamp, etc. Take care. Hello caroline!"
ham,I'm serious. You are in the money base
ham,"Hello, my love! How goes that day ? I wish your well and fine babe and hope that you find some job prospects. I miss you, boytoy ... *a teasing kiss*"
ham,ÌÏ comin to fetch us oredi...
ham,Happy New Year Princess!
ham,U come n search tat vid..not finishd..
ham,This single single answers are we fighting? Plus i said am broke and you didnt reply
ham,Well you told others you'd marry them...
ham,G wants to know where the fuck you are
ham,The bus leaves at  &lt;#&gt; 
ham,I am on the way to tirupur.
ham,Mm feeling sleepy. today itself i shall get that dear
ham,"Awesome, be there in a minute"
ham,I'm at home. Please call
ham,That's necessarily respectful
ham,Sounds like you have many talents! would you like to go on a dinner date next week?
ham,"Fighting with the world is easy, u either win or lose bt fightng with some1 who is close to u is dificult if u lose - u lose if u win - u still lose."
ham,Oh... Okie lor...We go on sat... 
ham,Anytime lor...
spam,"I want some cock! My hubby's away, I need a real man 2 satisfy me. Txt WIFE to 89938 for no strings action. (Txt STOP 2 end, txt rec å£1.50ea. OTBox 731 LA1 7WS. )"
ham,"Whenevr ur sad, Whenevr ur gray, Remembr im here 2 listn 2 watevr u wanna say, Jus walk wid me a little while,&amp; I promise I'll bring back ur smile.:-)"
spam,"Fantasy Football is back on your TV. Go to Sky Gamestar on Sky Active and play å£250k Dream Team. Scoring starts on Saturday, so register now!SKY OPT OUT to 88088"
ham,"Not sure yet, still trying to get a hold of him"
ham,Ugh just got outta class
ham,Did u turn on the heater? The heater was on and set to &lt;#&gt; degrees.
ham,She's fine. Sends her greetings
spam,GENT! We are trying to contact you. Last weekends draw shows that you won a å£1000 prize GUARANTEED. Call 09064012160. Claim Code K52. Valid 12hrs only. 150ppm 
ham,Were trying to find a Chinese food place around here
ham,Well boy am I glad G wasted all night at applebees for nothing
ham,"No shit, but I wasn't that surprised, so I went and spent the evening with that french guy I met in town here and we fooled around a bit but I didn't let him fuck me"
ham,"Wen ur lovable bcums angry wid u, dnt take it seriously.. Coz being angry is d most childish n true way of showing deep affection, care n luv!.. kettoda manda... Have nice day da."
ham,You should change your fb to jaykwon thuglyfe falconerf
ham,Moji just informed me that you saved our lives. Thanks.
ham,Your gonna have to pick up a $1 burger for yourself on your way home. I can't even move. Pain is killing me.
spam,"Urgent! call 09066612661 from landline. Your complementary 4* Tenerife Holiday or å£10,000 cash await collection SAE T&Cs PO Box 3 WA14 2PX 150ppm 18+ Sender: Hol Offer"
spam,PRIVATE! Your 2003 Account Statement for 07973788240 shows 800 un-redeemed S. I. M. points. Call 08715203649 Identifier Code: 40533 Expires 31/10/04
ham,"Nope, I'm still in the market"
ham,"Friendship is not a game to play, It is not a word to say, It doesn\'t start on March and ends on May, It is tomorrow, yesterday, today and e"
spam,UR awarded a City Break and could WIN a å£200 Summer Shopping spree every WK. Txt STORE to 88039.SkilGme.TsCs087147403231Winawk!Age16+å£1.50perWKsub
ham,Yupz... I've oredi booked slots 4 my weekends liao... 
ham,"Sorry, got a late start, we're on the way"
ham,You busy or can I come by at some point and figure out what we're doing tomorrow
ham,"Sorry, I'll call later"
ham,"7 wonders in My WORLD 7th You 6th Ur style 5th Ur smile 4th Ur Personality 3rd Ur Nature 2nd Ur SMS and 1st \Ur Lovely Friendship\""... good morning dear"""
ham,"Good afternoon, my love. It was good to see your words on YM and get your tm. Very smart move, my slave ... *smiles* ... I drink my coffee and await you."
ham,Are you still getting the goods.
ham,"My life Means a lot to me, Not because I love my life, But because I love the people in my life, The world calls them friends, I call them my World:-).. Ge:-).."
ham,R u sure they'll understand that! Wine * good idea just had a slurp!
ham,Dear reached railway. What happen to you
spam,"Sunshine Hols. To claim ur med holiday send a stamped self address envelope to Drinks on Us UK, PO Box 113, Bray, Wicklow, Eire. Quiz Starts Saturday! Unsub Stop"
ham,If you ask her or she say any please message.
ham,Hey.. Something came up last min.. Think i wun be signing up tmr.. Hee
ham,"Finally it has happened..! Aftr decades..! BEER is now cheaper than PETROL! The goverment expects us to \DRINK\"". . . But don't \""DRIVE \"""""
ham,Man this bus is so so so slow. I think you're gonna get there before me
spam,sports fans - get the latest sports news str* 2 ur mobile 1 wk FREE PLUS a FREE TONE Txt SPORT ON to 8007 www.getzed.co.uk 0870141701216+ norm 4txt/120p 
ham,Ok. Every night take a warm bath drink a cup of milk and you'll see a work of magic. You still need to loose weight. Just so that you know
ham,Rats. Hey did u ever vote for the next themes?
spam,Double your mins & txts on Orange or 1/2 price linerental - Motorola and SonyEricsson with B/Tooth FREE-Nokia FREE Call MobileUpd8 on 08000839402 or2optout/HV9D
ham,"Japanese Proverb: If one Can do it, U too Can do it, If none Can do it,U must do it Indian version: If one Can do it, LET HIM DO it.. If none Can do it,LEAVE it!! And finally Kerala version: If one can do it, Stop him doing it.. If none can do it, Make a strike against it ..."
ham,"Yeah probably, I still gotta check out with leo"
ham,Nah im goin 2 the wrks with j wot bout u?
spam,"1000's flirting NOW! Txt GIRL or BLOKE & ur NAME & AGE, eg GIRL ZOE 18 to 8007 to join and get chatting!"
spam,Get the official ENGLAND poly ringtone or colour flag on yer mobile for tonights game! Text TONE or FLAG to 84199. Optout txt ENG STOP Box39822 W111WX å£1.50
ham,"I'm in a meeting, call me later at"
ham,Yup. Thk of u oso boring wat.
ham,Have you got Xmas radio times. If not i will get it now
ham,Oops i thk i dun haf enuff... I go check then tell Ì_..
ham,"Babe! How goes that day ? What are you up to ? I miss you already, my Love ... * loving kiss* ... I hope everything goes well."
ham,Ok lor. Msg me b4 u call.
ham,Me fine..absolutly fine
ham,"\Petey boy whereare you me and all your friendsare in theKingshead come down if you canlove Nic\"""""
ham,Sat right? Okay thanks... 
ham,Ok. I asked for money how far
ham,Missed your call cause I was yelling at scrappy. Miss u. Can't wait for u to come home. I'm so lonely today.
spam,Married local women looking for discreet action now! 5 real matches instantly to your phone. Text MATCH to 69969 Msg cost 150p 2 stop txt stop BCMSFWC1N3XX
ham,I (Career Tel) have added u as a contact on INDYAROCKS.COM to send FREE SMS. To remove from phonebook - sms NO to  &lt;#&gt;
ham,Hi.:)technical support.providing assistance to us customer through call and email:)
ham,"Dear,Me at cherthala.in case u r coming cochin pls call bfore u start.i shall also reach accordingly.or tell me which day u r coming.tmorow i am engaged ans its holiday."
spam,Guess who am I?This is the first time I created a web page WWW.ASJESUS.COM read all I wrote. I'm waiting for your opinions. I want to be your friend 1/1
ham,Okay but i thought you were the expert
ham,Po de :-):):-):-):-). No need job aha.
ham,Sian... Aft meeting supervisor got work 2 do liao... U working now?
